Date,Title
29/9/2022,Apple Extends Decline as BofA Downgrades to Neutral on More Balanced Risk/Reward
29/9/2022,Take Advantage of Pullback and Buy Apple Stock - Analyst
28/9/2022,Fast Company shuts website after hack sends 'obscene' Apple News notifications
28/9/2022,Russia demands Apple explain VK removal from App Store
28/9/2022,Wall Street bounces off lows as UK steps in to calm bonds
28/9/2022,Wall Street ends sharply higher as Treasury yields dip
28/9/2022,5 Rumors Circling Wall Street Today
28/9/2022,Stock Market Today: Dow Racks Up Gains Amid Plunging Treasury Yields
28/9/2022,S&P 500 Rides Slump in U.S. Treasury Yields Higher
28/9/2022,"Midday Movers: Biogen, Apple, DocuSign and More"
28/9/2022,Apple Production Reports Sound 'a Little Weird': TF International
28/9/2022,Apple falls on fears of slowing iPhone 14 demand
28/9/2022,U.S. Stocks Rise as Bond Yields Ease
28/9/2022,"Apple, Qualcomm, Lyft Fall Premarket; Biogen, Netflix Rise"
28/9/2022,Apple drops plan to boost iPhone production as demand falters-Bloomberg
28/9/2022,"Dow Futures Largely Flat; Fed Speakers, Apple Sales in Focus"
28/9/2022,"Bond Rout Lifts Dollar, Apple Output Plans, Gas Sabotage- What's Moving Markets"
28/9/2022,"Apple Falls 4% on Report It Will Not Ramp Up iPhone 14 Production, Analyst Not Surprised"
28/9/2022,Marketmind: Gimme Shelter
28/9/2022,"Facing talent shortage, Taiwanese chip test firm ASE boosts automation"
27/9/2022,"Factbox-Companies cut jobs, freeze hiring to prepare for economic slowdown"
27/9/2022,Stock Market Today: Dow Ends Wild Ride in Red as Bears Strengthen Grip
27/9/2022,S&P 500 Stumbles as Tech Struggles to Hold Gains
26/9/2022,China's industrial profit declines accelerate as demand weakens
26/9/2022,Stock Market Today: Dow Stumbles as Jump in Rates Rattles Markets
26/9/2022,S&P 500 in U-Turn as Rising Treasury Yields Bite
26/9/2022,"PG&E, Las Vegas Sands, Planet Fitness Rise Premarket; Li Auto, Lyft Fall"
26/9/2022,Apple says it will manufacture iPhone 14 in India
26/9/2022,Apple To Offer NFTs on IOS for a 30% Commission on Sales
26/9/2022,'Grotesquely overpriced' — Apple's App Store wants 30% cut on NFT sales
23/9/2022,Wall St slumps as investors fret on rate hikes and recession
23/9/2022,SoftBank looks to form a 'strategic alliance' between Arm and Samsung
23/9/2022,Stock Market Today: Dow Bears Sharpen Claws as Recession Fever Spikes
23/9/2022,Dow Plunges into Bear Market  as Recession Fears Rattle Investors
23/9/2022,U.S. Stocks Tumble on Fear of Global Economic Slowdown
23/9/2022,"Costco, FedEx, Boeing Fall Premarket; Raytheon, FuboTV Rise"
23/9/2022,"Costco, FedEx, Boeing Fall Premarket; Raytheon, FuboTV Rise"
23/9/2022,Apple will sponsor Super Bowl halftime show starting in February
22/9/2022,Stock Market Today: Dow Ends Lower as Post-Fed Stumble Continues
22/9/2022,"Ford shuffles management in a push to bolster supply chain, EV units"
22/9/2022,"Investors Find a Lot to Like in Tech, Even as a Market Bottom Remains Elusive"
21/9/2022,Stock Market Today: Dow in Wild Ride to End Lower After Fed Hikes Rates
21/9/2022,Automakers tackle patent hurdle in quest for in-car tech
21/9/2022,EFFORCE Launches Public Sale of Steve Wozniak-inspired Genesis NFTs to Implement Two Energy Efficiency Projects
21/9/2022,iPhone 14: Aggressive Carrier Promotions is a 'Significant Positive’ for Apple - Analysts
21/9/2022,What Ethereum Migration to Proof-of-Stake Means to Web3 CEOs
21/9/2022,Apple is 'More Aggressively' Relocating Production from China to India and Vietnam - JPM
21/9/2022,Apple may move a quarter of iPhone production to India by 2025 -JPM
21/9/2022,Decentraland Calls For Creators To Enter The Market With NFT Emotes
21/9/2022,Meta And South Korea To Collaborate To Strengthen Metaverse Security
20/9/2022,Stock Market Today: Dow Slides as Focus Shifts to Hawkish Fed
20/9/2022,"S&P 500 Off Lows, but Fed Hike Fears Keep Up Pressure"
20/9/2022,S&P 500 Buybacks Plunge 21.8% in Q2 as Financials Pull Back Sharply
20/9/2022,Shiba Eternity Launches In Australia As Bone ShibaSwap (BONE) Grows 13%
20/9/2022,Netflix Rekindles Analyst Interest After 60% Wipeout
20/9/2022,Apple Announces App Store Price Hikes in Some Regions; Analyst Bullish on iPhone 14 Pricing Mix
20/9/2022,"Apple helps Taiwan export orders resume growth in August, outlook mixed"
20/9/2022,"Apple to raise App Store prices in some countries in Europe, Asia"
19/9/2022,Wall Street ends choppy session higher with focus firmly on Fed
19/9/2022,Stock Market Today: Dow in Comeback as Dip-Buyers Pile into Tech After Yields Jump
19/9/2022,S&P 500 Cuts Losses as Dip-Buying Helps Tech Move Off Lows
19/9/2022,"Cracked iPhone back glass? Some new models much easier to fix, firm finds"
19/9/2022,Apple: Strong iPhone 14 Pro/Pro Max is Offsetting Weak 14/Plus Demand - KeyBanc
19/9/2022,Nvidia Is on Sale and Cathie Wood Is a Big Buyer
19/9/2022,Taiwan August export orders likely contract as demand eases - Reuters poll
18/9/2022,Can You Sue for Injuries in the Metaverse?
17/9/2022,"New iPhones have Qualcomm satellite modem, new Apple radio chips"
17/9/2022,Shiba Inu Launches its Game Shiba Eternity in Australia
16/9/2022,"'Succession,' 'Ted Lasso' repeat as winners of top Emmy awards"
16/9/2022,U.S. antitrust officials ask to join arguments in Apple appeal
16/9/2022,Goldman Sachs Faces Fed Scrutiny of Money-Losing Marcus Consumer Unit
15/9/2022,"Wall St tumbles amid Fed tightening jitters, economic rumblings"
15/9/2022,"Apple, Amazon pass on media rights to Saudi-backed LIV Golf - WSJ"
15/9/2022,Exclusive-Tesla weighs reset for China retail strategy even as sales boom
15/9/2022,Samsung Elec to invest over $5 billion as it targets net zero emissions by 2050
15/9/2022,"'Succession,' 'Ted Lasso' repeat as winners of top Emmy awards"
14/9/2022,"Apple is Now the Most Shorted Stock in the U.S., Overtaking Tesla"
14/9/2022,How Can Traders Stay On Their Toes At All Times? Use PrimeXBT iOS & Android Apps
14/9/2022,"Google loses challenge against EU antitrust decision, other probes loom"
14/9/2022,Apple iPhone 14 Pro Adoption is 
14/9/2022,"Apple plans to use latest chip tech by Taiwan's TSMC in iPhones, Macs - Nikkei"
14/9/2022,Analysis-Google's court setback is good news for landmark EU tech rules
14/9/2022,"Pre-Open Movers: Tech Stocks Lift After Drubbing, Block Falls on Downgrade"
14/9/2022,"Top Apple Analyst Forecasts Below-Consensus FY Revenue and EPS, Sees 'Elevated' Valuation"
14/9/2022,Google's long battle with EU antitrust regulators
14/9/2022,"The Metaverse Is Being Built by a Community of  Futurists, DecentWorld’s Creators Say"
14/9/2022,U.S. to discuss new chips bill with Taiwan next month
13/9/2022,Wall St tumbles to biggest loss in two years following CPI data
13/9/2022,Stock Market Today: Dow Plunges 1200 Points in Tech Selloff After Inflation Report
13/9/2022,"Stocks Tumble After Inflation Report. Dow Sheds 1,000 Points."
13/9/2022,"Midday Movers: Tech Stocks, Cheniere, Twitter and More"
13/9/2022,Electoral Court Vetoes Candidacy of the ‘Pharaoh of Bitcoins’ for Deputy in Brazil
13/9/2022,Apple's iPhone 14 Satellite Compatibility Highlights Advantages of SpaceX - Morgan Stanley
13/9/2022,Shiba Inu (SHIB) Unveils A Hidden Resort in SHIB: The Metaverse
13/9/2022,China Mobile Phone Shipment Data for July is 'Incremental Negative' for Chipmakers
13/9/2022,"'Succession,' 'Ted Lasso' repeat as winners of top Emmy awards"
13/9/2022,"Pre-Open Movers: Akero Doubles on Drug Data, Tech Stocks Fall on Hot CPI"
13/9/2022,Taiwan's GlobalWafers sees Nov groundbreaking for $5 billion Texas plant
12/9/2022,Wall Street posts fourth straight day of gains ahead of CPI report
12/9/2022,"Stock Market Today: Dow Starts Week on Strong Footing as Energy, Tech Gain"
12/9/2022,Apple Rallies Most Since May on Strong IPhone Pre-Order Data
12/9/2022,S&P 500 Gains as Apple Rally Boosts Tech Ahead of Inflation Data
12/9/2022,Google considers making some Pixel phones in India - The Information
12/9/2022,Sweatcoin (SWEAT) Breaks Public Sale Record On DAOMaker Hours To Web3 Launch
12/9/2022,Apple: iPhone 14 Pre-order Demand Robust - Analysts
11/9/2022,Top 10 U.S. States That Are Most Interested in Cryptocurrency
9/9/2022,"Google, Apple facing anti-competitive complaint in Mexico"
9/9/2022,EU to consult on making Big Tech contribute to telco network costs
9/9/2022,Former Meta Executives Raises $300 Million In Funding To Develop Sui Blockchain
9/9/2022,Fake Apple Crypto Scam Fools Thousands Of Viewers On Youtube
8/9/2022,Stock Market Today: Dow Climbs but Tough Talking Powell Keeps Lid on Gains
8/9/2022,White House unveils principles for Big Tech reform
8/9/2022,Starlink had talks with Apple over satellite messaging feature - Musk
8/9/2022,"S&P 500 Rises in Choppy Trade as Banks Shine, Big Tech Wavers"
8/9/2022,SpaceX CEO Elon Musk: 'We’ve Had Some Promising Conversations with Apple'
8/9/2022,Globalstar's Apple Deal Provides 'Constructive Growth Outlook' - Morgan Stanley
8/9/2022,"New Apple iPhone will be available in Russia, trade minister says"
8/9/2022,General Motors to Develop Platform Targeting Chinese Affluent
8/9/2022,Apple lovers in some Asian countries to pay more for iPhone 14
8/9/2022,"'As Expected', 'Selling Fear'... 7 Analysts Discuss Apple's New Products"
8/9/2022,"Hedge funds root for Vietnam, China R&D among Asia picks at Sohn conference"
7/9/2022,"Apple offers adventure watch, satellite SOS iPhone — and steady prices"
7/9/2022,Exclusive-General Motors targets China's urban rich with luxury imports
7/9/2022,Stock Market Today: Dow Racks Up Gains as Tech Shines on Cooling Yields
7/9/2022,Apple picks Globalstar for emergency satellite service on iPhone 14
7/9/2022,"Apple Launching iPhone 14 and Other Products, a 'Major Feat' Says Analyst"
7/9/2022,S&P 500 Climbs as Tech Makes Comeback After Yields Slip; Apple Unveils New iPhones
7/9/2022,Netflix looks to control cloud computing costs with AWS - WSJ
7/9/2022,"Midday Movers: Twitter, United Airlines, Coupa Software and More"
7/9/2022,"Union groups, investors seek worker rights review at Apple"
7/9/2022,Here's Why An Analyst Expects Apple Stock Selloff to Resume this Week
7/9/2022,"Apple, ChargePoint, Pinterest Rise Premarket; Nio, Newell Brands Fall"
7/9/2022,"Yen Slide, Beige Book, iPhone 14 - What's Moving Markets"
7/9/2022,What is expected at Apple's 'Far Out' fall event?
7/9/2022,Apple's 'Far Out' Event: Goldman Sachs Says Unlikely iPhone Pro Model Prices Will Be Raised
7/9/2022,"Taiwan exports up in Aug; war in Ukraine, inflation cloud outlook"
7/9/2022,Meta to Invest $150 Million Into Immersive Learning Program
6/9/2022,Trump media deal suffers blow as SPAC fails to win extension
6/9/2022,Apple to appeal Brazil sales ban of iPhone without charger
6/9/2022,Wall Street ends busy post-summer session in the red
6/9/2022,Ireland fines Instagram a record $400 million over children's data
6/9/2022,Stock Market Today: Dow Stumbles as Stronger Data Stoke Larger Rate-Hike Fears
6/9/2022,"Google to launch Pixel Watch, Pixel 7 on Oct 6"
6/9/2022,S&P 500 Slips as Yield Surge Weighs on Tech
6/9/2022,"Muse Tops UK Charts With NFT Album, Setting Trends For Web 3.0 In The Music Industry"
6/9/2022,Verizon Still Attracts Investors During a Miserable 2022
6/9/2022,Deal partner for Trump's Truth Social fails to get backing for SPAC extension -sources
5/9/2022,Ireland fines Instagram a record $400 million over children's data
4/9/2022,"Big Tech Metaverses: All You Need to Know about Meta, Microsoft, Google, And Apple"
2/9/2022,Self-driving tech firm Aurora mulls sale to Apple or Microsoft - Bloomberg News
2/9/2022,Social media app Parler returns to Google's Play Store
2/9/2022,Stock Market Today: Dow Extends Weekly Slump as Europe Energy Concerns Dent Stocks
2/9/2022,Apple's iPhone Now Accounts for Over Half of the Active Installed Base in the U.S.
2/9/2022,S&P 500 in U-Turn as European Energy Crisis Fears Mount on Gazprom Delay
2/9/2022,Shenzhen shuts most public transport as China battles multiple outbreaks
2/9/2022,"Exclusive-Apple, Samsung could benefit as India aims to speed product safety approvals"
2/9/2022,U.K. Competition Watchdog Gives Final Clearance to Norton-Avast Merger
2/9/2022,Taiwan August exports seen up for 26th straight month: Reuters poll
1/9/2022,"Arm sues Qualcomm, aiming to unwind Qualcomm's $1.4 billion Nuvia purchase"
1/9/2022,Taiwan president says she looks forward to producing 'democracy chips' with U.S
31/8/2022,"Apple, HTC cleared in U.S. trade tribunal dispute over wireless patents"
31/8/2022,Crypto Flipsider News – Market Update; Animoca Brands Funding; Ethermine Staking Service; Hodlnaut’s IJM Approved; Qatar Crypto License
31/8/2022,"Snap to cut 20% of staff, cancel projects in cost-cutting effort"
31/8/2022,Apple Analyst Urges Investors to Focus on iPhone 14 Pricing at 'Far Out' Event
31/8/2022,An Ominous Month Looms For Battered Nasdaq Bulls
31/8/2022,"Taiwan's TSMC progressing well with Arizona chip plant, governor says"
31/8/2022,Foreign business travel missing ingredient for Irish hotel recovery - Dalata
31/8/2022,Reef’s Highly Anticipated Reef Card is Officially Available for Crypto Holders
30/8/2022,Apple chief privacy officer set to leave company for law firm -Bloomberg News
30/8/2022,Wall St closes down for 3rd straight session on Fed rate hike worry
30/8/2022,Stock Market Today: Dow Stumble Continues as Tech Bleeds on Rate Hike Fears
30/8/2022,Truth Social Android app not approved on Google Play Store
30/8/2022,S&P 500 Slips on Tech Rout as Strong Economic Data Stoke Hawkish Fed Jitters
30/8/2022,Susquehanna Strong Believers in Broadcom Ability to Outperform Large-Cap Peers
30/8/2022,Best Buy says pricey smartphone sales holding strong ahead of next iPhone launch
30/8/2022,"5000APL Tier Mining Pool Reward has Run Out, AMAX#1 Mining Pool is Releasing an Urgent Call"
30/8/2022,"Australia demands Apple, Meta, Microsoft share anti-abuse steps, threatens fines"
29/8/2022,Wall Street retreats as rate hike concerns persist
29/8/2022,"Stock Market Today: Dow Fights Back, but Ends in Red as Tech Wreck Bites"
29/8/2022,"JOLTs Openings, Consumer Confidence, Best Buy: 3 Things to Watch"
29/8/2022,"S&P 500 Cuts Losses on Energy Rally, but Tech Slump Weighs"
29/8/2022,Exclusive-Win for Qualcomm as no EU appeal court ruling against $991 million fine - sources
29/8/2022,"Nasdaq Pares Early Losses as Apple, Microsoft, Chip Stocks Fall"
29/8/2022,"Apple, Amazon, Tesla Lower in Premarket Trade; Pinduoduo Rallies"
29/8/2022,iPhone 14 Launch Event Is 'Another Pivotal Moment' for Apple - Wedbush
29/8/2022,Peloton and Zoom Show More Pain for Covid Trade 
29/8/2022,Cardano outranks Bitcoin in global top intimate brands in new report
26/8/2022,U.S. Justice Department in early stages of drafting possible antitrust suit against Apple -Politico
26/8/2022,Justice Department Lawyers in Early Stages of Preparing Antitrust Suit Against Apple - Politico
26/8/2022,HP Inc. Risk 'Remains Skewed to the Downside' - Morgan Stanley
26/8/2022,Electronic Arts Shoots Higher on Amazon Bid Report
25/8/2022,Dell fans slowdown fears with weak revenue forecast
25/8/2022,"Wall Street ends sharply up, fueled by Nvidia and Amazon"
25/8/2022,Cannabis fintech Bespoke to expand BNPL base in cash-starved industry
25/8/2022,Billionaire Och sues former firm Sculptor over escalating CEO pay
25/8/2022,Shiba Inu (SHIB) SuperStore Invites To Burn SHIB With The Help Of Amazon
25/8/2022,Apple Raising Prices for iPhone Pro Models Would be a 'Notable Tailwind' - Analyst
24/8/2022,Shiba Inu (SHIB) Creates 10 New Discord Channels Related to SHIB Metaverse
24/8/2022,"Apple sends invites for Sept 7 event, analysts expect new iPhones"
24/8/2022,Visa tokens overtake payments giant's physical cards in circulation
24/8/2022,Match Group Files Antitrust Case Against Apple in India - Reuters
24/8/2022,Exclusive-Tinder-owner Match ups antitrust pressure on Apple in India with new case
24/8/2022,A Bad Year May Get Worse for Snapchat and Facebook Owners
23/8/2022,How the Ukraine-Russia war rattled global financial markets
23/8/2022,Former Apple car engineer pleads guilty to trade secret theft
23/8/2022,Truth Social to join Rumble's advertising platform
23/8/2022,Introducing GAMESWIFT: The Next Generation WEB3 Ecosystem
23/8/2022,Chip Giant Nvidia's Stock Slump Fails to Remove Its Pricey Tag
23/8/2022,XPeng Denies Connection as Ex-Apple Employee Charged with IP Theft
22/8/2022,Wall Street ends sharply lower on fears of aggressive Fed
22/8/2022,GE workers in Alabama launch union organizing campaign
22/8/2022,Apple's Potential NFL Sunday Ticket Deal 'Makes Sense' - Evercore ISI
20/8/2022,"Apple supplier Foxconn to invest $300 million more in northern Vietnam, state media reports"
19/8/2022,Wall Street ends down as yields rise; indexes post weekly losses
19/8/2022,Shiba Inu (SHIB) and Dogecoin (DOGE) Boat Rocked By Ethereum (ETH) Whales
19/8/2022,"Midday Movers: Bed Bath & Beyond, Cineworld, Wayfair and More"
19/8/2022,KeyBanc Recommends Owning Apple - Boosts Price Target
19/8/2022,ByteDance's Douyin teams up with Alibaba's Ele.me in mini programme push
19/8/2022,Taiwan says it has not been informed of 'Chip 4' meeting
19/8/2022,Taiwan July export order growth seen slowing on cooling demand: Reuters poll
18/8/2022,Qualcomm planning return to server market with new chip - Bloomberg News
18/8/2022,This Indicator Signals Apple Stock Could Hit $230 - Bank of America
17/8/2022,Bed Bath & Beyond slides after investor Ryan Cohen files for stake sale
17/8/2022,Stock Market Today: Dow Slips on Target Earnings Miss; Chips Dip to Dent Tech
17/8/2022,Apple Targets September 7 for iPhone 14 Launch Event - Bloomberg
17/8/2022,"Shiba Inu (SHIB) Is Looking At Another Breakout, Says Gokhshtein"
17/8/2022,Apple Stock Earns a New Street-High Price Target at Wedbush on iPhone 2023 Cycle
17/8/2022,Experts explain what 'Big Short' Michael Burry's stock exit means for crypto
16/8/2022,Apple Upgraded to Outperform From Neutral at Credit Suisse
16/8/2022,"Stock Market Today: Dow Rides Rally in Retailers to Close Above 34,000"
16/8/2022,Dog Race Between SHIB & DOGE: Which Memecoin To The Moon First?
16/8/2022,"S&P 500 Edges Higher as Retailers Rally on Walmart, Home Depot Results"
16/8/2022,Apple Lays Off Contract-Based Recruiters in Hiring Slowdown - Bloomberg
16/8/2022,Cake DeFi: A Quick Overview
16/8/2022,"Shiba Inu Surges Over 30%, At Highest Since April"
16/8/2022,Netflix Burns Shorts as ‘Extreme’ Bearishness Ebbs
15/8/2022,"Buffett's Berkshire boosts Ally, Activision holdings; sheds Verizon"
15/8/2022,"Two Sigma, Soros among hedge funds positioned for tech comeback"
15/8/2022,"Wall Street climbs, adding to recent gains as megacaps rise"
15/8/2022,Apple sets Sept 5 deadline for employees to return to office - Bloomberg
15/8/2022,Caste in California: Tech giants confront ancient Indian hierarchy
15/8/2022,Apple's $30 million settlement over employee bag checks gets court approval
15/8/2022,Apple May Add Ads to Maps and Other Apps - Bloomberg
15/8/2022,"Big Short's Burry Liquidates ~$200M in Long Stock Bets, Now Has Just One Stock"
15/8/2022,Snap Shares Rise as Snapchat+ Tops 1 Million Users
15/8/2022,T-Mobile Surprises as Tech Winner in Tough Stock Market
15/8/2022,Apple Could Outperform Into iPhone Event but Overall Risk/Reward Unfavorable
14/8/2022,Saudi Aramco's Amin Nasser: a homegrown engineer who reached the top
13/8/2022,Crypto Success Story: How Hi Gained 3.5M Members without Advertising
12/8/2022,YouTube plans to launch streaming video service - WSJ
12/8/2022,Stock Market Today: Dow in 4th Weekly Win as Chip Helps Tech Shine
12/8/2022,S&P 500 Gains as Chip Stocks Lead Tech Higher
12/8/2022,Explainer-How could the new U.S. corporate minimum tax affect companies?
12/8/2022,"Apple, Rivian, Toast Rise Premarket; Illumina, Olo Fall"
12/8/2022,Taiwan revises down 2022 GDP growth forecast on inflation woes
11/8/2022,Apple Expects to Sustain iPhone Sales in 2022 as Market Slows
11/8/2022,Stock Market Today: Dow Flat as Rebound in U.S. Yields Drags Down Tech
11/8/2022,S&P 500 Pares Gains as Treasury Yields Move Off Lows Despite Easing Inflation
11/8/2022,Explainer-How could the new U.S. corporate minimum tax affect companies?
11/8/2022,"Samsung unveils new foldable smartphones, seeking keep lead in growing market"
10/8/2022,Wall Street rally lifts Nasdaq 20% from low as inflation fears ebb
10/8/2022,"Bumble cuts annual revenue forecast as Ukraine war, competition bite"
10/8/2022,Stock Market Today: Dow Racks Up Gains as Easing Inflation Triggers Tech Rally
10/8/2022,Meta raises $10 billion in first-ever bond offering
10/8/2022,S&P 500 Rides Tech Rally as Easing Inflation Pushes U.S. Yields Lower
10/8/2022,KBW 2022: Digital property rights key to thriving Web3 economy — Animoca’s Yat Siu
9/8/2022,Taiwan security officials want Foxconn to drop stake in Chinese chipmaker - FT
9/8/2022,"Issey Miyake, Japan's prince of pleats, dies of cancer aged 84 - media"
9/8/2022,Foxconn to build autonomous electric tractors at Ohio facility
9/8/2022,South Korea to probe app store operators over suspected in-app payment violations
9/8/2022,KBW 2022: Digital property rights key to thriving Web3 economy — Animoca’s Yat Siu
8/8/2022,Putin allows Russian banks under sanctions to halt some FX operations
8/8/2022,Apple 'Portfolio Has Never Been Stronger' - Monness Crespi
8/8/2022,"Taiwan July exports jump, but uncertainty ahead"
8/8/2022,Japanese investors were big buyers of foreign equities in July
6/8/2022,Berkshire Hathaway posts $43.8 billion loss as stock holdings tumble
6/8/2022,"Berkshire Hathaway Posts Strong Operating Results as Buyback, Stock Buying Slows"
5/8/2022,"Factbox: Companies cut jobs, freeze hiring to prepare for economic slowdown"
5/8/2022,Apple asks suppliers to follow China customs rules - Nikkei
5/8/2022,"Exclusive: Deezer to begin German expansion using Brazil, France model - CEO"
4/8/2022,EU antitrust regulators quiz developers on Google app payments - sources
4/8/2022,Facebook parent Meta set to raise $10 billion in bond debut -sources
4/8/2022,Goldman discloses probe into U.S. credit card division
4/8/2022,Too Soon for Growth Stocks - UBS
4/8/2022,China's memory upstart YMTC edges closer to rivals with 232-layer chip
4/8/2022,Taiwan July exports seen growing at slower pace amid rising uncertainties - Reuters Poll
3/8/2022,Nasdaq ends at three-month high as PayPal fuels optimism
3/8/2022,Chip makers have a message for car makers: Your turn to pay
3/8/2022,Stock Market Today: Dow Delivers Swashbuckling Gains as Earnings Shine
3/8/2022,"U.S. corporate profits, economic outlooks, surprisingly upbeat"
3/8/2022,"S&P 500 in Rally Mode on Positive Earnings, Stronger Economic Data"
3/8/2022,Apple App Store Growth Decelerated in July - Morgan Stanley
3/8/2022,"Factbox-Companies cut jobs, freeze hiring to prepare for economic slowdown"
3/8/2022,Avast Shares Spike as U.K. Competition Watchdog Green Lights Merger with U.S. Peer
3/8/2022,"As US eyes new China chip curbs, turmoil looms for global market"
2/8/2022,Alibaba and Tencent Face End of an Era as Sales Start to Shrink
2/8/2022,Shiba Inu (SHIB) Reveals “Shiba Eternity” in Celebration of 2nd Anniversary
2/8/2022,Apple drops mask requirements for most of its corporate workers - The Verge
1/8/2022,U.S. considers crackdown on memory chip makers in China
1/8/2022,Apple is sued by French app developers over app store fees
1/8/2022,Stock Market Today: Dow Starts August in Red as Global Growth Fears Bite
1/8/2022,S&P Stutters as Global Growth Concerns Dent Recent Optimism
1/8/2022,Oracle starts job cuts in U.S. - The Information
1/8/2022,"Midday Movers: Boeing, Apple, NIO and More"
1/8/2022,Factbox: Recession fears creep into corporate America as growth slows
1/8/2022,Chinese Battery Material Stocks Surge on new Tesla Supply Deal
31/7/2022,Top 5 Things to Watch in Markets in the Week Ahead
29/7/2022,Meta's Mark Zuckerberg: Company's pandemic-era forecast was too rosy
29/7/2022,"S&P 500, Nasdaq register biggest monthly gains since 2020"
29/7/2022,"Big tech, oil extend Wall Street's mid-summer rebound"
29/7/2022,Stock Market Today: Dow in Best Month Since 2020 as Big Tech Powers Ahead
29/7/2022,US lawmaker calls for Apple and Google to provide info on fake crypto apps
29/7/2022,"S&P 500 Rises as Apple, Amazon Rally to Keep Big Tech in Demand"
29/7/2022,Slowdown in PC Sales is Taking a Bite Out of Tech
29/7/2022,"Factbox: Companies cut jobs, freeze hiring to prepare for economic slowdown"
29/7/2022,"Midday Movers: Apple, Roku, Exxon Mobil and More"
29/7/2022,Wood’s ARK fund on track for first monthly gain since Oct as risky stocks rally
29/7/2022,"Metaverse Jobs Are Disappearing as Hiring Slows at Google, Facebook "
29/7/2022,"Amazon, Apple raise hopes as investors brace for slowdown"
29/7/2022,"U.S. Stocks Rise After Strong Earnings from Apple, Amazon"
29/7/2022,"Pre-Open Movers: Amazon, Apple Gain on Results; Intel Plummets on Disappointment"
29/7/2022,"Amazon, Apple, Exxon, Chevron Rise Premarket; Roku, Intel Fall"
29/7/2022,Marketmind: The consumer's deep pockets and short arms
29/7/2022,"U.S. Futures Rise as Amazon, Apple Shares Surge Before Market Open"
29/7/2022,"Apple, Amazon Earnings, Eurozone GDP, Biden and Xi, OPEC+ - What's Moving Markets"
29/7/2022,"Apple Tops Earnings Estimates as iPhone Excels Again, Analysts Positive"
29/7/2022,"Taiwan Q2 GDP grows at slowest in two years on China lockdowns, COVID"
29/7/2022,"Apple forecasts faster sales growth, strong iPhone demand despite glum economy"
29/7/2022,Apple faces lukewarm demand in China after quarterly revenue drop -analysts
28/7/2022,"Asian Stocks Mixed, Follow Rise in U.S. Equities"
28/7/2022,"Wall St ends up sharply for 2nd day; Amazon.com, Apple jump after hours"
28/7/2022,Apple Narrowly Tops Estimates as iPhone Fares Better Than Feared
28/7/2022,"Dow Futures Flat, Apple and Amazon Report"
