Date,Title
13/9/2021,Apple Stock is Bouncing Back Ahead of Big Product Event
13/9/2021,'Fortnite' creator Epic Games to appeal ruling in Apple case
12/9/2021,Asian Stocks Down as Risk of Slower COVID-19 Recovery Increases
12/9/2021,ViacomCBS to restructure Paramount Pictures - WSJ
12/9/2021,Momentum is Shifting on Wall Street
10/9/2021,Analysis-Epic's narrow win in App Store case toughens fight against Google Play rules
10/9/2021,Epic ruling invites future efforts to paint Apple as monopolist -experts
10/9/2021,"Wall Street ends down, Apple sinks on app store ruling"
10/9/2021,"Trading tantrum? Fed officials' personal dealings stir controversy, call for change"
10/9/2021,"Apple must ease App Store rules, U.S. judge orders"
10/9/2021,Wall Street shares down as inflation worry offsets U.S.-China optimism
10/9/2021,U.S. stocks lower at close of trade; Dow Jones Industrial Average down 0.78%
10/9/2021,"Factbox-Apple vs Epic case: heated arguments, dramatic calls"
10/9/2021,Apple Slips as Judge Says It Can’t Force Developers to Use In-app Purchasing
10/9/2021,Robert W. Baird Stick to Their Buy Rating for Apple Hospitality REIT
10/9/2021,Apple rebuffs Epic request to restore Fortnite developer account in South Korea
9/9/2021,El Salvador president steps in to fix bitcoin rollout snags
9/9/2021,Samsung decision on new U.S. chip plant location 'imminent' -Texas county judge
9/9/2021,Facebook unveils its first smart glasses
9/9/2021,"Apple Stock: Brand Loyalty, Earnings Paint Pretty Picture"
9/9/2021,"Amazon: Cheap FAANG Stock, New CEO"
9/9/2021,Fed officials to sell stocks to avoid apparent conflict of interest
9/9/2021,Visa: Should Investors Raise their Bets?
9/9/2021,Verizon: What to Make of Slumping Telecom Stock
9/9/2021,"Google's voice assistant in new EU antitrust investigation, MLex reports"
9/9/2021,JPMorgan appoints Allison Beer as CEO of Chase's card business
9/9/2021,Wall Street's subdued finish fails to detract from strong August (Aug 31)
9/9/2021,Nobel laureate Doudna's biotech Mammoth hits over $1 billion in valuation
8/9/2021,"Wall Street ends lower, weighed down by Big Tech"
8/9/2021,Apple Stock: Innovation Key to Sustaining Brand Power
8/9/2021,"3 FAANG Stocks to Buy, 2 to Avoid"
8/9/2021,Apple Stock: Innovation Key to Sustaining Brand Power
8/9/2021,"3 FAANG Stocks to Buy, 2 to Avoid"
8/9/2021,U.S. FTC meeting will scrutinize Big Tech's small deals
8/9/2021,"Nvidia seeks EU approval for Arm deal, decision due Oct. 13"
8/9/2021,El Salvador's world-first adoption of bitcoin endures bumpy first day
7/9/2021,Ford poaches Apple's car project chief Doug Field
7/9/2021,"S&P 500 ends down, Big Tech lifts Nasdaq to record"
7/9/2021,Apple Stock: Could this iPhone Feature Propel Shares?
7/9/2021,Salvador street protest breaks out against bitcoin adoption
7/9/2021,U.S. stocks mixed at close of trade; Dow Jones Industrial Average down 0.76%
6/9/2021,"Garmin: Great Products, a Little Pricey"
6/9/2021,Binance limits SGD product offerings in Singapore amid regulatory warnings 
6/9/2021,"Spotify: Predictable Growth, Slim Income Margins"
6/9/2021,Binance limits product offerings in Singapore following regulatory warnings
5/9/2021,Binance limits SGD product offerings in Singapore amid regulatory warnings 
5/9/2021,Netflix: Is the Risk Worth the Reward?
5/9/2021,"Hong Kong media group Next Digital says it aims to wind down, board quits"
5/9/2021,Twitter Targeting Content Creators to Trounce Competition
5/9/2021,Nio Earnings Surge despite Crackdown on Big Tech
3/9/2021,Tech drives Nasdaq to record finish but Wall Street mixed on jobs report
3/9/2021,"Global stock benchmark at new high, dollar slips"
3/9/2021,Match Group asks Dutch regulators to reveal possible Apple antitrust decision
3/9/2021,"After criticism, Apple says it will delay child safety updates"
3/9/2021,Wall Street Opens Lower After Jobs Disappointment; Dow Down 120 Pts
3/9/2021,Exclusive-Tokyo ready to back Western Digital-Kioxia deal if key tech stays in Japan - sources
3/9/2021,U.S. labor agency probes two complaints from Apple workers
2/9/2021,"Analysis-Apple's App Store concessions fail to address top concerns of regulators, lawmakers"
2/9/2021,Broadcom forecasts upbeat current-quarter sales on 5G bet
2/9/2021,Apple must face Siri voice assistant privacy lawsuit -U.S. judge
2/9/2021,Explainer-Apple gives 'reader' apps a way around commissions. Who wins?
2/9/2021,Apple must face Siri voice assistant privacy lawsuit -U.S. judge
2/9/2021,Explainer-Apple gives 'reader' apps a way around commissions. Who wins?
2/9/2021,Lurch to Right May Imperil Texas’s Attraction for Employers
2/9/2021,Wall Street Opens at Record as Jobless Data Fail to Damp Taper Hopes; Dow up 110
2/9/2021,"Apple offers small concession in easing App Store rules for Netflix, others"
2/9/2021,Special Report-How the Chinese tycoon driving Volvo plans to tackle Tesla
2/9/2021,Exclusive-Apple hit with antitrust case in India over in-app payments issues
2/9/2021,"Ida Batters NYC, Jobless Claims, China's Tech Squeeze - What's Moving Markets"
2/9/2021,Marketmind: Currencies at a crossroad
1/9/2021,Wells Fargo Stick to Their Buy Rating for Zynga
1/9/2021,"Helped by TSMC and Foxconn, BioNTech vaccines finally reach Taiwan"
1/9/2021,"Tech stocks send Nasdaq to fresh record close, boost S&P"
1/9/2021,Launching into space? Not so fast. Insurers balk at new coverage
1/9/2021,"Hormel Foods, Broadcom, DocuSign: 3 Things to Watch"
1/9/2021,Apple Tops $2.5 Trillion Market Cap as States Sign Up for Wallet
1/9/2021,Marketmind: Don't stop me now
31/8/2021,Wall Street's subdued finish fails to detract from strong August
31/8/2021,"S&P 500 Slips, But Monthly Win Streak Continues"
31/8/2021,"S.Korea's parliament passes bill to curb Google, Apple commission dominance"
31/8/2021,S&P 500 Slips From Record Highs as Stocks Struggle for Direction
31/8/2021,BitPay wallet integrates 1inch Network DEX aggregator 
31/8/2021,"Google, Apple Forced to Open App Store Pay Systems in South Korea"
31/8/2021,Wall Street Opens Lower as House Price Rise Revives Taper Fears; Dow Down 35 Pts
31/8/2021,"Zoom, Robinhood Fall Premarket; Designer Brands Rises"
31/8/2021,"Apple Slips, Alphabet Flat as S. Korea Sets Precedent on App Store Payments"
31/8/2021,JMP Securities Stick to Their Buy Rating for Jamf Holding
30/8/2021,"S&P, Nasdaq post record closes on dovish Fed taper-talk"
30/8/2021,U.S. stocks mixed at close of trade; Dow Jones Industrial Average down 0.16%
30/8/2021,"Zoom Video, Crowdstrike, Consumer Confidence: 3 Things to Watch"
30/8/2021,Globalstar Soars on Report iPhone 13 May Feature Satellite Communications
30/8/2021,MapmyIndia targets valuation of up to $817 million with IPO filing this week - source
30/8/2021,"Australia considering new laws for Apple, Google, WeChat digital wallets"
27/8/2021,Apple Stock Remains Well-Positioned to Grow
27/8/2021,Nvidia set to seek EU okay for $54 billion Arm deal -sources
26/8/2021,Apple strikes App Store deal with small developers as it waits for 'Fortnite' ruling
26/8/2021,S&P 500 Stalls Amid Caution on Wall Street Ahead of Powell
26/8/2021,S&P 500 Stutters as Traders Wary of Making Big Bets Ahead of Jackson Hole
26/8/2021,"2 WallStreetBets Stocks to Buy, 2 to Avoid"
26/8/2021,Taiwan Semi Gains on Report It Is Raising Chip Prices 10%-20%
26/8/2021,Column-Wall Street boom or bubble? Don't blame it all on the Fed: Jamie McGeever
25/8/2021,U.S. stocks higher at close of trade; Dow Jones Industrial Average up 0.11%
25/8/2021,"S&P 500 Closes Just Shy of 4,500 Amid Record Climb"
25/8/2021,"S&P 500, Nasdaq Continue Record Run as Financials, Energy Shine"
25/8/2021,"Xiaomi revenue surges 64%, prepares autonomous driving expansion"
25/8/2021,Robert W. Baird Stick to Their Buy Rating for Apple Hospitality REIT
25/8/2021,"S.Korea parliament committee votes to curb Google, Apple commission dominance"
25/8/2021,Global corporate profits to fall 8% in Q3 after record Q2 - data
24/8/2021,"White House to tackle cyber challenges with Apple, IBM, insurance CEOs"
24/8/2021,"Factbox-Major U.S. companies making masks, vaccines mandatory"
24/8/2021,"South Korea set to curb Google, Apple commission dominance"
24/8/2021,"S&P 500, Nasdaq at Record Highs; House Makes Progress on $3.5T Budget"
24/8/2021,"S&P 500, Nasdaq Hover at Fresh Record Highs as Energy Powers Ahead"
24/8/2021,Are Shares of Apple a Buy Under $150?
24/8/2021,"Battery pioneer Akira Yoshino on Tesla, Apple and the electric future"
24/8/2021,"Chinese Bounce, Dems' Spending Impasse; Best Buy - What's Moving Markets"
24/8/2021,"FuboTV: Strong Growth, Competitive Positioning at Reasonable Price"
24/8/2021,Taiwan seeks again to reassure U.S. over tackling chip shortage
24/8/2021,Phemex announces support for Solana [SOL]
23/8/2021,Amazon CEO Andy Jassy to join executives at White House cybersecurity meeting -source
23/8/2021,Nasdaq Hits Record as Tech Racks Up Gains
23/8/2021,"S&P 500, Nasdaq Ride Energy, Tech Rally to Record Highs"
23/8/2021,3 Top Stocks to Buy as the Semiconductor Shortage Continues
23/8/2021,"Concerns around data privacy are rising, and blockchain is the solution"
23/8/2021,"Delta variant, having put kibosh on Fed event, begins to menace recovery"
22/8/2021,"Concerns around data privacy are rising, and blockchain is the solution"
20/8/2021,"Factbox-Major U.S. companies making masks, vaccines mandatory"
20/8/2021,"S&P 500 Ends Higher as Tech Reigns Supreme, but Snaps Weekly Win Streak"
20/8/2021,Oil posts biggest week of losses in nine months as Delta variant spreads
20/8/2021,S&P 500 Advances as Tech Flexes Muscles
20/8/2021,Nvidia's $40 billion deal for ARM dealt blow by UK regulator
20/8/2021,S&P 500 Advances as Tech Flexes Muscles
20/8/2021,Nvidia's $40 billion deal for ARM dealt blow by UK regulator
20/8/2021,Apple delays office return to January as Delta variant spreads - Bloomberg
20/8/2021,"Analysis-Red tape, risk aversion clip wings of Merkel's innovation legacy"
20/8/2021,"Taiwan July export orders leap again, COVID variants a concern"
19/8/2021,Exclusive-China Evergrande in talks with Xiaomi consortium to sell EV unit stake-sources
19/8/2021,5 Stocks Working to Achieve Carbon Neutrality
19/8/2021,S&P 500 Ekes Out Gain as Tech Shines in Wild Session
19/8/2021,S&P 500 Cuts Losses on Tech Strength as Traders Contend Wild Swings
19/8/2021,"Facebook launches VR remote work app, calling it a step to the 'metaverse'"
18/8/2021,S&P 500 Stumbles as Fed Signals Tapering This Year
18/8/2021,U.S. stocks lower at close of trade; Dow Jones Industrial Average down 1.08%
18/8/2021,S&P 500 Slips as Fed Sees Tapering Starting This Year
18/8/2021,"Crypto Flipsider News – August 18th – Bitcoin to $100K, Buterin & Governance Model Alternatives, VISA’s Crypto Partners, ETH Burning, NFTs for Afghanistan, OpenSea, Wayne Gretzky, SuperRare"
17/8/2021,S&P 500 Snaps 5-Day Streak as Retail Sales Flag Consumer Worries
17/8/2021,Walmart gears up to make big entry into crypto space
17/8/2021,S&P 500 Slumps as Worries Over Consumer Grow After Retail Sales Slide
17/8/2021,"TikTok Bans Crypto, But Audius Makes Crypto Music Sound Good"
16/8/2021,"Buffett's Berkshire pares drug holdings, sheds Axalta, Biogen"
16/8/2021,"S&P 500, Dow Cuts Losses to Close at Record Highs Ahead of Powell"
16/8/2021,"Buffett's Berkshire pares drug holdings, sheds Axalta, Biogen"
16/8/2021,"S&P 500, Dow Cuts Losses to Close at Record Highs Ahead of Powell"
16/8/2021,S&P 500 Cuts Losses to Clinch Record Highs
16/8/2021,3 Apple Supplier Stocks to Buy Before the Launch of the iPhone 13 in September
16/8/2021,Here’s Why Trimble Could Blast Higher in the Coming Months 
16/8/2021,Walmart Is Looking for a DeFi Expert to Join Their Team
16/8/2021,"Tesla, T-Mobile Fall Premarket; Sonos Rises"
16/8/2021,"Dow  Futures Down 100 Pts; Slowing China Growth, Geopolitical Turmoil Weighs"
16/8/2021,Hyatt Falls On $2.7 Billion Deal To Buy Apple Leisure
15/8/2021,"Hyatt to buy Apple Leisure Group from KKR, KSL Capital for $2.7 billion"
13/8/2021,ContextLogic Plunges As Losses Increase and Users Fall
13/8/2021,U.S. House members introduce bill targeting Apple and Google app stores
13/8/2021,Taiwan expects fastest growth in a decade this year on export boom
13/8/2021,Explainer: New York Governor Andrew Cuomo's legal woes far from over
12/8/2021,RBC Capital Stick to Their Buy Rating for Jamf Holding
12/8/2021,Exclusive: Apple's child protection features spark concern within its own ranks -sources
12/8/2021,U.S. stocks higher at close of trade; Dow Jones Industrial Average up 0.04%
12/8/2021,"S&P 500, Dow Keep Record Run Going on Apple-Led Gains in Tech"
12/8/2021,S&P 500 Climbs to Fresh Record High as Tech Finds Strength
12/8/2021,"Factbox-Major U.S. companies making masks, vaccines mandatory"
12/8/2021,Foxconn says watching for impact from worsening COVID-19 in Asia
11/8/2021,"S&P 500, Dow Hit Records Again as Cyclicals Shine"
11/8/2021,"U.S. lawmakers introduce bill to rein in Apple, Google app stores"
11/8/2021,"S&P 500, Dow Remain Near Fresh Records as Runaway Inflation Fears Cool"
11/8/2021,5 Stocks Hedge Funds Won't Stop Buying
11/8/2021,Explainer: New York Governor Andrew Cuomo's legal woes far from over
11/8/2021,How Sweden became the Silicon Valley of Europe
10/8/2021,"S&P 500, Dow Close at Records as Bulls Cheer Progress on Infrastructure Bill"
10/8/2021,"S&P 500, Dow in Record Run as Infrastructure Bill Clears Senate"
10/8/2021,"Crypto Flipsider News – August 10th – Circle Bank, Poloniex, Binance and Coinbase CEOs, AMC, Indian Unicorn"
10/8/2021,"S&P 500, Dow in Record Run as Infrastructure Bill Clears Senate"
10/8/2021,"Crypto Flipsider News – August 10th – Circle Bank, Poloniex, Binance and Coinbase CEOs, AMC, Indian Unicorn"
10/8/2021,"AMC & Bitcoin, a Speculation Match Made in Heaven"
9/8/2021,Wall Street Loves These 3 Tech Stocks
9/8/2021,"S&P 500 Stutters as Energy Slumps, But Financials Keep Losses in Check"
9/8/2021,Cuomo accuser who filed criminal report goes public in TV interview
9/8/2021,S&P 500 Slips on Energy But Still Trades Near Record High
9/8/2021,New York Governor Cuomo's top aide resigns amid sexual harassment scandal
9/8/2021,"Gold, Oil Prices Slump, Fedspeak, Bitcoin - What's Moving Markets"
8/8/2021,RBC Capital Stick to Their Buy Rating for Jamf Holding
7/8/2021,Warren Buffett's Berkshire Hathaway recovers from coronavirus slowdown
7/8/2021,Ready to deploy? Amazon’s Bitcoin acceptance can prime a payments future
6/8/2021,Analysis: Where will yields go? Investors weigh U.S. jobs data against Delta fears
6/8/2021,Apple to roll out photo checking system on country-by-country basis
6/8/2021,"S&P 500, Dow Notch Records as Jobs Report Renews Optimism on Recovery"
6/8/2021,"Factbox-Major U.S. companies making masks, vaccines mandatory"
6/8/2021,"S&P 500, Dow Remain Near Records as Cyclicals Gain on Stronger Jobs Report"
6/8/2021,"Zynga Tanks As Bookings Soften, User Acquisition Costs Rise"
6/8/2021,Ready to deploy? Amazon’s Bitcoin acceptance can prime a payments future
6/8/2021,"Crypto Flipsider News – August 6th – The White House, Ethereum, FTX Updates, Xiaomi, Spider-man NFTs"
6/8/2021,Coinbase users can now buy crypto with Apple Pay
5/8/2021,Apple to check iCloud photo uploads for child abuse images
5/8/2021,Coinbase adds Apple Pay to supported payment option
5/8/2021,The Bezos Way: What if Amazon Has its Way with Crypto
4/8/2021,"Factbox: Major U.S. companies making masks, vaccines mandatory"
4/8/2021,Australia welcomes first-ever cryptocurrency Mastercard
4/8/2021,Apple works with Chinese suppliers for latest iPhones - Nikkei
4/8/2021,Sony posts record Q1 profit on pandemic demand for devices and content
3/8/2021,"Tyson Foods, Microsoft mandate vaccinations, U.S. automakers mask up"
3/8/2021,"S&P 500 closes at record high as Apple, healthcare stocks help shrug off Delta worries"
3/8/2021,"Tyson Foods, Microsoft mandate vaccinations, U.S. automakers mask up"
3/8/2021,"S&P 500 closes at record high as Apple, healthcare stocks help shrug off Delta worries"
3/8/2021,'Tug of war' as investors digest mixed market messages
3/8/2021,"S&P 500 Rides Energy, Health Care to Close at Record"
3/8/2021,"S&P 500 Climbs as Energy, Industrials Shine"
3/8/2021,"Crypto Flipsider News – August 3rd – Miami Crypto, Digital Asset Investment, Binance, CoinJr, Independent Reserve, NFT Boom"
3/8/2021,U.S. company profits even bigger than Wall Street's lofty targets
3/8/2021,Aussie crypto exchange CoinJar partners with Mastercard for crypto cards
3/8/2021,The $29 billion deal in 11 weeks: how Square bought Afterpay
2/8/2021,Reese Witherspoon's media firm to be sold to Blackstone-backed company
2/8/2021,Dow Eases From Record as Stocks Struggle for Direction
2/8/2021,Twitter's Dorsey leads $29 billion buyout of lending pioneer Afterpay
2/8/2021,Qualcomm Slips As Google Decides To Build Own Processors
2/8/2021,Dow Futures Rise 95 Pts; Strong Earnings Season Continues
30/7/2021,S&P 500 Closes Lower as Oil Majors Dent Energy; Amazon Slumps
30/7/2021,XinFin Partners with Guarda Wallet and Simplex to Provide Easy Fiat Onramp for XDC
30/7/2021,"Walmart to require masks for some U.S. retail workers, vaccinations for corporate staff"
30/7/2021,Amazon hit with record EU data privacy fine
30/7/2021,Shaping the World of Ethical Finance
30/7/2021,"Stocks Slide, Amazon Cut, China Stocks Reverse, PCE Prices - What's Moving Markets"
30/7/2021,Shaping the World of Ethical Finance
30/7/2021,"Stocks Slide, Amazon Cut, China Stocks Reverse, PCE Prices - What's Moving Markets"
29/7/2021,Wall St gains with upbeat earnings and forecasts
29/7/2021,How Earnings and the Fed Will Impact the Stock Market
29/7/2021,S&P 500 Closes Near Record High as Bulls Bid Up Cyclical Stocks
29/7/2021,"S&P 500, Dow in Record Climb as Signs of Consumer Strength Boost Cyclicals"
29/7/2021,"LinkedIn allows employees to work fully remote, removes in-office expectation"
29/7/2021,What’s Next for Apple as it Forms a Key Resistance Level?
29/7/2021,Big Tech starts requiring vaccines; Twitter closes re-opened U.S. offices
29/7/2021,"From Facebook to Twitter, Big Tech sees social commerce driving sales growth"
29/7/2021,Latest shift to tech leaves Cathie Wood's ARKK in the cold
29/7/2021,IOTA: The New Competitive Advantage… Is Not Competing?
28/7/2021,"Facebook's slowdown warning hangs over strong ad sales, while Zuckerberg talks 'metaverse'"
28/7/2021,"Qualcomm optimistic on 5G, connected device sales as supply bottlenecks ease"
28/7/2021,Crypto Non-Grata? Why Did Amazon Deny Bitcoin Plans?
28/7/2021,S&P 500 Closes Flat as Fed Holds Rates Steady
28/7/2021,"Amazon, Comcast, More Earnings: 3 Things to Watch"
28/7/2021,"S&P 500 Climbs as Fed Keeps Rates Steady, Signals Progress on Tapering Goal"
28/7/2021,U.S. Stocks Mixed Ahead of Fed; Alphabet Stars
28/7/2021,"Alphabet, Boeing Rise Premarket; Starbucks, Spotify Fall"
28/7/2021,U.S. Stocks Mixed Ahead of Fed; Alphabet Stars
28/7/2021,"Alphabet, Boeing Rise Premarket; Starbucks, Spotify Fall"
28/7/2021,"U.S. Futures Mixed; Federal Reserve, Big Tech Stocks in Focus"
28/7/2021,"Fed Meeting, Big Tech's Big Quarter, Mask Warning - What's Moving Markets"
28/7/2021,"Apple Slips, With Chip Shortage Now at iPhone’s Door"
28/7/2021,"European Stocks Edge Higher; Deutsche Bank, Barclays Star With Quarterly Results"
28/7/2021,Marketmind: Gearing up for Jay
28/7/2021,"Asia shares sit at 2021 lows ahead of Fed decision, China steadies"
28/7/2021,"European Stock Futures Mixed Ahead of Fed; Rio Tinto, Deutsche Bank Earnings  Eyed"
27/7/2021,Asian Stocks Down as Chinese Crackdown Impact Continues
27/7/2021,2 Lidar Stocks Wall Street Predicts Will Rally More Than 55%
27/7/2021,European Digital Identity: Talao Announces Professional Credential Solution
27/7/2021,Wall Street falls ahead of big tech earnings; Nasdaq sheds 180 pts
27/7/2021,"Apple's iPhone expected to drive sales, but App Store faces regulatory risk"
27/7/2021,Dow Futures 90 Points Lower as Fed Meets and Big Tech Prepares to Report Earnings
27/7/2021,"Google, Facebook set to squash initial iOS fears, show big revenue jump"
27/7/2021,"China Markets Panic, Tesla Beats, Coffee Soars, Apple Due - What's Moving Markets"
27/7/2021,European Stocks Lower; Chinese Clampdown and Earnings in Focus
27/7/2021,Marketmind: Great Q2 but what's next?
27/7/2021,European Stock Futures Lower; Major Tech Earnings Due
27/7/2021,Taiwan seen growing at slower pace in second quarter; strong exports support: Reuters poll
26/7/2021,"Asia equities tick up, as investors look to the U.S."
26/7/2021,"Asian Stocks Up, Focus Now on “Profits and Fed” as Chinese, HK Shares Stabilize"
26/7/2021,"Apple, Microsoft, Alphabet Earnings: 3 Things to Watch"
26/7/2021,S&P 500 Notches Record as Investors Eye Big Tech Earnings
26/7/2021,"S&P 500 Hovers at Record Highs Ahead of Tech Earnings, Fed"
26/7/2021,Dow Futures 135 Pts Lower; Chinese Clampdown Weighs
26/7/2021,"European Stocks Lower; Chinese Clampdown, German Ifo Weigh"
26/7/2021,Marketmind: A China crackdown
26/7/2021,European Stock Futures Lower After China's Latest Attack on Tech
26/7/2021,Marketmind: A China crackdown
26/7/2021,European Stock Futures Lower After China's Latest Attack on Tech
25/7/2021,"Asia stocks hit seven-month low as China skids, funds favour Wall Street"
25/7/2021,"Asian Stocks Down, Focus on China Tech Crackdown and U.S.-China Talks"
25/7/2021,Top 5 Things to Watch in Markets in the Week Ahead
23/7/2021,"Wall Street surges to all-time closing high on earnings, economic revival"
23/7/2021,Big tech companies retake market reins with earnings on tap
23/7/2021,"Dow Closes Above 35,000 for First Time as Strong Earnings Stoke Bullish Bets"
23/7/2021,"S&P 500 Hits Fresh Record as Twitter, Snap Rally"
23/7/2021,Take Five: The great Fed conundrum
23/7/2021,"Nasdaq Futures Up 75 Pts; Twitter, Snap Dominate Sentiment"
23/7/2021,MSN Money Says Long-Term Investors Should Hold Cardano
23/7/2021,Column: Dominance of mega firms may undermine monetary policy
22/7/2021,"Twitter beats revenue targets with ad improvements, shares jump 5%"
22/7/2021,"Wall Street ekes out gains, led by tech, growth stocks"
22/7/2021,"Snap beats user, revenue estimates with highest growth in 4 years"
22/7/2021,S&P 500 Rides Tech to Close Higher After Surprise Gain in Jobless Claims
22/7/2021,"S&P 500 Inches Higher as Falling Yields Hurt Bank Stocks, Lift Tech"
22/7/2021,"Spending to fight U.S. unemployment fraud brings boost, scrutiny to Alphabet-funded ID.me"
21/7/2021,U.S. stocks higher at close of trade; Dow Jones Industrial Average up 0.83%
22/7/2021,"Spending to fight U.S. unemployment fraud brings boost, scrutiny to Alphabet-funded ID.me"
21/7/2021,U.S. stocks higher at close of trade; Dow Jones Industrial Average up 0.83%
21/7/2021,At least 25 dead as rains deluge central China's Henan province
21/7/2021,Testing interest in NFTs vs. physical collectibles with Apple founder’s 50-year-old job application 
21/7/2021,Analysis-Investors look to near $2 trillion corporate cash hoard to buoy stocks
21/7/2021,SoftBank's robotics ambitions short circuit as Pepper loses power
20/7/2021,Moderna dominates Wall St trading ahead of S&P 500 debut
20/7/2021,Pressure on Big Tech builds as Biden picks another critic for key Justice post
20/7/2021,"S&P 500 Makes Comeback as Airlines, Banks Shine"
20/7/2021,S&P 500 Stages Rebound on Dip-Buying Activity
20/7/2021,Apple to delay office returns to October - Bloomberg News
20/7/2021,"Binance Makes Hard Decision on Apple, Tesla, and Others"
20/7/2021,Netflix growth plan tops Wall St watchlist as lockdown love fades
20/7/2021,"IBM, Apple and Halliburton Rise Premarket; PPG Falls"
20/7/2021,Dow Futures 160 Pts Higher as IBM Posts Strong Results
20/7/2021,"Taiwan June export orders surge again, outlook bullish"
19/7/2021,S&P 500 Falls as Covid Resurgence Sparks Blood Bath on Wall Street
19/7/2021,S&P 500 Slumps as Covid Resurgence Rattles Stocks
19/7/2021,Amazon vs. Apple: Which Mega-Cap Stock is a Better Buy for the Second Half of 2021
19/7/2021,A decentralized app store might lead crypto toward more centralization
17/7/2021,A decentralized app store might lead crypto toward more centralization
16/7/2021,Wall Street ends down as Delta variant drives fears
16/7/2021,U.S. sanctions Chinese officials over Hong Kong democracy crackdown
16/7/2021,S&P 500 Snaps 3-Week Win Streak Despite Upbeat Start to Earnings Season
16/7/2021,S&P 500 Falls as Bulls in Hiding Despite Signs of Strong Consumer
16/7/2021,Xiaomi Up 4% On Overtaking Apple As Second Largest Smartphone Maker
16/7/2021,"U.S. Sends Message to Businesses, China With Hong Kong Warning"
16/7/2021,Here Are My Top 3 Robinhood Stocks to Buy Now
16/7/2021,Taiwan June export orders seen up for 16th straight month: Reuters poll
15/7/2021,Nasdaq ends lower as investors sell Big Tech
16/7/2021,Taiwan June export orders seen up for 16th straight month: Reuters poll
15/7/2021,Nasdaq ends lower as investors sell Big Tech
15/7/2021,S&P 500 Falls as Bulls Sidelined Despite Upbeat Earnings; Retail Sales Eyed
15/7/2021,"S&P 500 Sidesteps Positive Earnings as Tech, Energy Slip"
15/7/2021,Analysis: Return to the U.S. office? Ask the CEO
15/7/2021,"TSMC eyes expansion in U.S., Japan to meet sustained chip demand"
15/7/2021,Michael Saylor: “Bitcoin Is Big Tech Without The Company”
15/7/2021,Apple Has Bought BTC: Bulls Smell a Short Squeeze
14/7/2021,"Toyota buys U.S. mapping, road data firm to bulk up driverless tech"
14/7/2021,S&P 500 ends higher after Powell lulls market
14/7/2021,S&P 500 Ekes Out Gain as Tech Rally Offset by Wobble in Energy
14/7/2021,U.S. stocks mixed at close of trade; Dow Jones Industrial Average up 0.13%
14/7/2021,"S&P 500 Trickles From Record as Energy, Financials Weigh"
14/7/2021,Apple says it has deployed $1 billion from $2.5 billion California housing fund
14/7/2021,Wall Street Opens Higher as Powell Again Shrugs Off Inflation; Dow Breaches 35k
