Date,Title
18/8/2020,U.S. stocks mixed at close of trade; Dow Jones Industrial Average down 0.24%
18/8/2020,U.S. stocks mixed at close of trade; Dow Jones Industrial Average down 0.24%
18/8/2020,U.S. stocks mixed at close of trade; Dow Jones Industrial Average down 0.24%
18/8/2020,U.S. stocks mixed at close of trade; Dow Jones Industrial Average down 0.24%
18/8/2020,U.S. stocks mixed at close of trade; Dow Jones Industrial Average down 0.24%
18/8/2020,U.S. stocks mixed at close of trade; Dow Jones Industrial Average down 0.24%
18/8/2020,U.S. stocks mixed at close of trade; Dow Jones Industrial Average down 0.24%
18/8/2020,U.S. stocks mixed at close of trade; Dow Jones Industrial Average down 0.24%
18/8/2020,Detached from reality? Why U.S. stocks just hit a new high
18/8/2020,Big Tech drives S&P 500 to record high in coronavirus rally
18/8/2020,New U.S. curbs threaten Huawei's smartphone crown and hit suppliers
18/8/2020,Taiwan-based Apple supplier Catcher to sell two divisions to China's Lens for $1.4 billion
18/8/2020,Norway wealth fund sees turbulent times ahead on financial markets
18/8/2020,Tech-fuelled 'everything's awesome' rally looks unstoppable
18/8/2020,Hong Kong leader says won't take U.S. sanctions against her to heart
17/8/2020,Epic Games asks judge to block Apple's removal of 'Fortnite' from app store
17/8/2020,TikTok's journey from global sensation to Trump target
17/8/2020,Apple expands independent repair shop program to Mac computers
17/8/2020,Apple's 'extreme' app policies give Google defense in Fortnite antitrust suit
17/8/2020,TikTok signs music distribution deal with UnitedMasters
17/8/2020,TikTok signs music distribution deal with UnitedMasters
17/8/2020,'Fortnite' app removal threatens social lifeline for young gamers
15/8/2020,'Fortnite' app removal threatens social lifeline for young gamers
14/8/2020,Trump orders ByteDance to divest interest in U.S. TikTok operations within 90 days
14/8/2020,"In lawsuit, 'Fortnite' maker to test idea of iPhone as market unto itself"
14/8/2020,"Epic Games wins support from 'Fortnite' gamers, firms on Apple standoff"
14/8/2020,"Facebook bashes Apple for refusing to waive commission fees, seizing on backlash"
14/8/2020,Big U.S. funds gorged on tech stocks and gold in second quarter: 13F filings
14/8/2020,Take Five: Impasse!
14/8/2020,"Stocks - iQIYI, Baidu Stocks Drop Premarket; Tesla Gains"
14/8/2020,Stocks - US Futures Largely Lower; Dow Futures Down 122 Pts
14/8/2020,"Top 5 Things to Know in the Market on Friday,  August 14th"
14/8/2020,Stocks - US Futures Largely Lower; Dow Futures Down 122 Pts
14/8/2020,"Top 5 Things to Know in the Market on Friday,  August 14th"
14/8/2020,"Fortnite maker sues Apple, Google after removal of game from app stores"
13/8/2020,"Texas, California governors take heat in battle over school reopenings"
13/8/2020,Three more U.S. states launching coronavirus exposure warning apps
13/8/2020,U.S. Justice Department going 'full tilt' on tech antitrust probe: official
13/8/2020,U.S. stocks mixed at close of trade; Dow Jones Industrial Average down 0.29%
13/8/2020,S&P 500 ends down slightly after flirting with record levels again
13/8/2020,"U.S. downloads of WeChat, Signal apps spike after Trump threatens ban"
13/8/2020,Apple to bundle ViacomCBS services on AppleTV+ at a discount
13/8/2020,Epic Files Suit Against Apple After Fortnite Removed From App Store
13/8/2020,S&P 500 Hobbles to Negative Close as Bulls Made to Wait for Record High
13/8/2020,S&P 500 Push for Record Close Falters as Big Tech Gives Up Some Gains
13/8/2020,Apple readies subscription bundles to boost services: Bloomberg News
13/8/2020,Corporate America worries WeChat ban could be bad for business: WSJ
13/8/2020,IPhone Maker Pegatron to Take Over Casing Unit to Fight Luxshare
13/8/2020,"Released tycoon Lai says Hong Kong needs patient, not radical, democracy campaign"
13/8/2020,"China’s Days as World’s Factory Are Over, IPhone Maker Says"
12/8/2020,England's revamped contact-tracing app to begin public trials on Thursday: BBC
12/8/2020,U.S. stocks higher at close of trade; Dow Jones Industrial Average up 1.05%
12/8/2020,Apple’s Split Will End Dominance of Dow Average’s Top Influencer
12/8/2020,S&P 500 inches toward record high on tech boost
12/8/2020,"Goldman Sachs, Barclays among bidders for GM's credit card business: WSJ"
12/8/2020,"Tesla woos retail investors with stock split, shares rise"
12/8/2020,"Apple supplier Foxconn's profit beats view, sees smartphone demand off lows"
12/8/2020,Regulator warning ends Hong Kong's Next Digital share rally
12/8/2020,Smartphone shipments in China plunge 35% in July: government data
11/8/2020,"Exclusive: U.S. ban on TikTok could cut it off from app stores, advertisers - White House document"
11/8/2020,Tesla sets 5-1 stock split and its high-flying stock soars again
11/8/2020,Airbnb backs OECD approach to digital services tax
11/8/2020,Tesla sets 5-1 stock split and its high-flying stock soars again
11/8/2020,Airbnb backs OECD approach to digital services tax
11/8/2020,U.S. stocks lower at close of trade; Dow Jones Industrial Average down 0.38%
11/8/2020,Explainer: How the U.S. could block WeChat and TikTok from Americans
11/8/2020,S&P 500 in Ugly Reversal as Tech Wreck Dashes Path to Record High
11/8/2020,S&P 500 in U-Turn as Tech Moves Deeper Into Red Amid Stimulus Stalemate
11/8/2020,U.S. appeals court reverses antitrust ruling against Qualcomm
11/8/2020,S&P 500 nears record high on stimulus bets
11/8/2020,Hong Kong's Apple Daily vows to fight on after owner arrested
11/8/2020,‘Stay-at-Home’ Safety Trade Unravels With Big Tech Left Behind
11/8/2020,"Martin Scorsese joins Apple's Hollywood roster for new films, TV shows"
11/8/2020,Zynga Gets Zapped as Berenberg Cuts to Hold on Apple Policy
11/8/2020,Google turns Android phones into earthquake sensors; California to get alerts
11/8/2020,"Arm rival SiFive raises $60 million from SK Hynix, Aramco"
11/8/2020,S&P 500 futures hit record high on stimulus bets
11/8/2020,HK's Next Digital hits 12-year high after campaign to support arrested owner
10/8/2020,"Dow Rallies as Bulls Find Value in Energy, Industrials; Virus Spread Slows"
10/8/2020,"Dow Climbs as Energy Steps Up, Tech Pares Losses"
10/8/2020,"Facebook, Microsoft gripes with Apple's App Store on EU's antitrust radar"
10/8/2020,Russian watchdog says Apple abused mobile app market dominance
10/8/2020,"Hong Kong tycoon Jimmy Lai arrested under security law, bearing out 'worst fears'"
10/8/2020,"Stocks - Twitter, Apple Rise Premarket; Kodak Drops"
10/8/2020,Hong Kong police raid on newspaper filmed in real time as China flexes muscles
10/8/2020,HK's Next Digital soars as activists rally support for arrested tycoon Jimmy Lai
9/8/2020,"Saudi Aramco's profit plunges, sees signs of oil market recovery"
8/8/2020,Coronavirus punishes Warren Buffett as Berkshire Hathaway takes big writedown
8/8/2020,"Point/Counterpoint: As Apple Nears $2 Trillion Value, Just Right or Too Hot?"
7/8/2020,U.S. stocks mixed at close of trade; Dow Jones Industrial Average up 0.17%
7/8/2020,Dow Ends Week Higher as Traders Overlook Lack of Deal Making on Capitol Hill
7/8/2020,Dow Trades Sideways Amid Stalling Stimulus Progress
7/8/2020,Trump’s WeChat Ban Brings China Cold War Into a Billion Homes
7/8/2020,World stocks end four-day winning streak as U.S.-China tensions grow
7/8/2020,"Indonesia imposes 10% VAT on Facebook, Disney, Tiktok"
6/8/2020,"Tencent Sinks With Chinese Stocks, Yuan After Trump’s WeChat Ban"
6/8/2020,U.S. stocks higher at close of trade; Dow Jones Industrial Average up 0.68%
6/8/2020,Nasdaq Closes Above 11K for First Time Ever as Tech Soars
6/8/2020,"Dow Higher as Tech Reigns Supreme, but Slow Stimulus Progress Weighs"
6/8/2020,Wedbush Stick to Their Buy Rating for Zynga
6/8/2020,KeyBanc Stick to Their Buy Rating for Zynga
6/8/2020,COVID-19 vaccine approval could stall tech stocks boom: Goldman
6/8/2020,KeyBanc Stick to Their Buy Rating for Zynga
6/8/2020,COVID-19 vaccine approval could stall tech stocks boom: Goldman
5/8/2020,"Wall Street Rallies as Bulls Feast on Stimulus, Vaccine Optimism"
5/8/2020,Virginia touts nation's first contact tracing app with Apple-Google tech
5/8/2020,Dow Jumps as Lawmakers Step Up Efforts to Get Stimulus Bill Over the Line
5/8/2020,Factbox: Facebook and TikTok's fraught history
5/8/2020,"Samsung launches new Note, foldable phone as pandemic shrinks market"
5/8/2020,"Buffett's Berkshire bought $2.07 billion BofA stock since mid-July, has 11.9% stake"
5/8/2020,"Dow Opens Higher on Economic Relief Progress, U.S.-China Talks"
5/8/2020,Apple Stock Split Fuels Retail-Trader Bets on Further Gains
5/8/2020,Wedbush Stick to Their Buy Rating for Glu Mobile
5/8/2020,Wedbush Stick to Their Buy Rating for Activision Blizzard
5/8/2020,Oppenheimer Stick to Their Buy Rating for Activision Blizzard
5/8/2020,"Top 5 Things to Know in the Market on Wednesday, August 5th"
5/8/2020,Are they any use? With Europe's black-box coronavirus apps it's hard to tell
4/8/2020,Day Ahead: 3 Things to Watch for August 5
4/8/2020,Nasdaq Bags Another Record High as Big Tech Cuts Losses Into Close
4/8/2020,"Dow Rises, but Stimulus Worries Weigh"
4/8/2020,Apple Marketing Chief Phil Schiller to Stand Down
4/8/2020,Apple says it has no interest in buying TikTok
4/8/2020,Apple Marketing Chief Phil Schiller to Stand Down
4/8/2020,Apple says it has no interest in buying TikTok
4/8/2020,Google's $2.1 billion Fitbit deal hits roadblock as EU opens probe
4/8/2020,Robinhood Crowd Helps Hedge Fund Manager Gain 30% This Year
4/8/2020,Dow Opens Slightly Lower as U.S.-China Tensions Over TikTok Grow
4/8/2020,‘Too Big to Fail’ Is the New Mantra for Bulls in Stock Market
4/8/2020,Stocks - U.S. Futures Point to Slightly Lower Open; Dow Futures Dip 47 Points
4/8/2020,"Top 5 Things to Know in the Market on Tuesday, August 4th"
4/8/2020,"China Won’t Allow a TikTok ‘Smash and Grab’ by U.S., State Media Warns"
3/8/2020,Google owner Alphabet issues record $10 billion bond at lowest-ever price
3/8/2020,Day Ahead: 3 Things to Watch for August 4
3/8/2020,Nasdaq ends at record high as traders eye M&A and stimulus
3/8/2020,Nasdaq Races to Record High as Big Tech Reigns Supreme
3/8/2020,Dow Gains as Big Tech Continues Reign; Microsoft Jumps on TikTok Talks
3/8/2020,"Google unveils first 5G phones, cuts price on base Pixel model"
3/8/2020,Chinese artificial intelligence company files $1.4 billion lawsuit against Apple
3/8/2020,Spain to roll out COVID-19 app twice as effective as human tracers in pilot
3/8/2020,Summer mood swings: markets turn higher on hopes of virus aid
3/8/2020,Big Tech Faithful Shouldn’t Ignore Antitrust Risk
3/8/2020,Stocks - Dow Futures 0.3% Higher Amid Stimulus Uncertainty
3/8/2020,Microsoft nears big bet on TikTok after risky LinkedIn deal shows promise
3/8/2020,Dollar’s 10% Slide Is a Warning That U.S. Has Lost Grip on Virus
2/8/2020,Samsung crafts India comeback as anti-China wave surges
2/8/2020,U.S. companies leap over low profit hurdle in coronavirus-hit quarter
2/8/2020,Economic Calendar - Top 5 Things to Watch This Week
1/8/2020,"Southern California 'Apple Fire' forces nearly 8,000 to evacuate"
1/8/2020,"Apple's Taiwan suppliers, Samsung apply for India's smartphone scheme"
1/8/2020,Apple removes thousands of game apps from China store: research firm
1/8/2020,Weekly Comic: Fed Stimulus Helps Power Stocks Back Toward Record Highs
1/8/2020,Point/Counterpoint: The Case for Spotify
31/7/2020,"Google says 20 U.S. states, territories 'exploring' contact tracing apps"
31/7/2020,U.S. stocks higher at close of trade; Dow Jones Industrial Average up 0.44%
31/7/2020,Apple tops Saudi Aramco as most valuable publicly listed company
31/7/2020,"Dow, Nasdaq Stage Late Rally on Big Tech Profit"
31/7/2020,"Canada extends travel ban to August 31, launches COVID-19 contact tracing app"
31/7/2020,Wall Street weighed down by fiscal aid uncertainty as tech boost fades
31/7/2020,"SAP, Deutsche Telekom to build corona app gateway for European Commission"
31/7/2020,U.S. consumer spending presses ahead; declining income poses challenge
31/7/2020,Apple Briefly Tops Saudi Aramco as World’s Most Valuable Company
31/7/2020,Stocks - Wall Street Opens Higher on Big Tech Q2 Surge; Dow up
31/7/2020,Northern Ireland launches UK's first COVID-19 tracker app
31/7/2020,"Take Five: It's August, what could go wrong?"
31/7/2020,Apple loyalists prove physical stores not needed to drive iPhone sales: J.P. Morgan
31/7/2020,"European shares rebound from lows, euro set for best month in a decade"
31/7/2020,"Stocks - Apple, Amazon, Facebook Rise Premarket; Chevron Falls"
31/7/2020,Stocks - U.S. Futures Higher on Big Tech Gains; Dow Futures Up 50 Pts
31/7/2020,Wedbush Stick to Their Buy Rating for Zynga
31/7/2020,"Top 5 Things to Know in the Market on Friday, July 31st"
31/7/2020,"Nokia, BNP earnings prop European stocks as growth worries linger"
31/7/2020,"SAP, Deutsche Telekom close to European coronavirus app deal: Wiwo"
31/7/2020,"Huawei, Apple gain bigger share of shrinking China smartphone market"
30/7/2020,Asian Stocks Down Amid a Tale of Two Sets of Data
30/7/2020,Apple's stock split may not be good for the Dow
30/7/2020,Buffett's Berkshire boosts its stake in Bank of America to 11.8%
30/7/2020,"Apple delivers blowout earnings amid COVID-19, market shrugs off iPhone delays"
30/7/2020,U.S. stocks mixed at close of trade; Dow Jones Industrial Average down 0.85%
30/7/2020,Day Ahead: 3 Things to Watch for July 31
30/7/2020,Apple Earnings Beat  in Q3 as iPhone Delivers Upside Surprise
30/7/2020,Amazon 2Q Sales Jump as Lockdowns Encourage Online Shopping
30/7/2020,Dow Ends Above Session Lows as Big Tech Holds Firm
30/7/2020,"S&P dips on grim data; U.S. election uncertainty, earnings"
30/7/2020,Dow Cuts Some Losses as Big Tech Rises Ahead of 'Seminal Night' of Earnings
30/7/2020,Google's $2.1 billion Fitbit deal faces EU antitrust probe: sources
30/7/2020,"Computing is the new horsepower, carmaker Audi says"
30/7/2020,Stocks - U.S. Futures Lower on GDP Fears; Dow Futures Down 240 Pts
30/7/2020,Big Tech results move center stage after Congressional bruising
30/7/2020,"Top 5 Things to Know in the Market on Thursday, July 30th"
30/7/2020,Samsung expects smartphone demand to drive second half earnings
30/7/2020,Huawei overtakes Samsung as top handset maker thanks to robust China sales
29/7/2020,Favorable ad search terms for Apple considered in deal with Amazon: documents
29/7/2020,"Exclusive: Arizona leads multi-state probe into older iPhones slowing, shutting down"
29/7/2020,"Facebook, Google absorb U.S. lawmakers' jabs in rare Big Tech hearing"
29/7/2020,"Qualcomm forecasts sales above estimates, settles dispute with Huawei"
29/7/2020,Dow Jumps as Powell Says Fed 'Not Even Thinking' About Raising Rates
29/7/2020,Day Ahead: 3 Things to Watch for July 30
29/7/2020,Facebook shouldn't become 'arbiters of truth' -Zuckerberg
29/7/2020,Dow Inches Higher as Fed Keeps Rates Steady; Big Tech in Political Hot Seat
29/7/2020,It Is Time for Blockchain to Prioritize Diversity and Inclusion
29/7/2020,Spotify revenue misses as coronavirus deters advertisers
29/7/2020,Watch Now: Here's What's Moving Markets - July 29 (Video)
29/7/2020,Can Apple's 24X7 services store-front make up for falling iPhone sales?
29/7/2020,Stocks - U.S. Futures Edge Higher Ahead of Fed Announcement
29/7/2020,"Top 5 Things to Know in the Market on Wednesday, July 29th"
28/7/2020,Big Tech CEOs to defend their companies before U.S. Congress by listing competitors
28/7/2020,"Emmy nominations, from 'Succession' to 'Schitt's Creek,' put premium on diversity"
28/7/2020,"Dow Sees Late Selling on Mixed Earnings, Downbeat Consumer"
28/7/2020,Day Ahead: 3 Things to Watch for July 29
28/7/2020,Wall St. pauses as pandemic hurts consumer confidence and earnings; stimulus underwhelms
28/7/2020,Dow Trickles Lower as Earnings Deluge Fails to Delight Bulls
28/7/2020,App Store chief says Apple aimed to level playing field for developers
27/7/2020,U.S. stocks higher at close of trade; Dow Jones Industrial Average up 0.43%
27/7/2020,Oprah Winfrey takes on racism in new TV discussion series for Apple TV+
27/7/2020,"Wall Street rises as investors watch stimulus, pandemic and earnings"
27/7/2020,Dow Ends Higher as Big Tech Delivers Boost Ahead of Earnings
27/7/2020,Day Ahead: 3 Things to Watch for July 28
27/7/2020,Dow Higher as Boeing Stems Weakness; Big Tech Jumps
27/7/2020,Facebook delays second-quarter results as Zuckerberg set to appear before Congress
27/7/2020,"Stocks - Wall Street Opens Mixed, Waiting on Policy; Dow Down 14 Pts"
27/7/2020,"Stocks - Moderna, Apple Rise Premarket; Hasbro Falls"
27/7/2020,Stocks - U.S. Futures Higher; Dow Futures Up 166 Pts
27/7/2020,"Stocks - Moderna, Apple Rise Premarket; Hasbro Falls"
27/7/2020,Stocks - U.S. Futures Higher; Dow Futures Up 166 Pts
27/7/2020,Wedbush Stick to Their Buy Rating for Activision Blizzard
27/7/2020,"Amazon expands workforce in Ireland to 5,000"
27/7/2020,Shutdown of America’s Chengdu Consulate Caps Week of China Tensions
26/7/2020,Watch Now: Here's What Will Move Markets This Week - July 26 (Video)
26/7/2020,Economic Calendar - Top 5 Things to Watch This Week
25/7/2020,House panel reschedules Big Tech CEO hearing for Wednesday
24/7/2020,"Wall Street Week Ahead: Investors hedging, worry about exuberance, as U.S. risks rise"
24/7/2020,U.S. House panel confirms delay of Monday's Big Tech CEO hearing
24/7/2020,S&P 500 Snaps 3-Week Winning Streak as Big Tech Runs Out of Steam
24/7/2020,"Oil Ends Week Mixed on Conflicting Growth, Demand Signals"
24/7/2020,Wall Street Stutters as Tech's Stumble Keeps Bulls Sidelined
24/7/2020,"Stocks - Intel, Moderna Fall Premarket; Mattel Rises"
24/7/2020,Big tech antitrust probe report from Congress likely by early fall
24/7/2020,Take Five: Action and reaction
24/7/2020,World shares retreat on rise in Sino-U.S. tensions
23/7/2020,"Intel chip delay forces shift to using more outside factories, shares drop"
23/7/2020,Big Tech CEOs ready defenses for U.S. Congress hearing into their growing power
23/7/2020,U.S. stocks lower at close of trade; Dow Jones Industrial Average down 1.31%
23/7/2020,Apple faces deceptive trade practices probe by multiple U.S. states: document
23/7/2020,Could your Fitbit or Apple Watch detect early COVID-19 symptoms?
23/7/2020,Dow Sees Red as Big Tech Struggles; Jump in Jobless Claims Sparks Worry
23/7/2020,SPACs Show Signs of Froth as Demand For Good-Story Stocks Grows
23/7/2020,"New York Times CEO sees risk in regulating Google, Facebook to help news media"
23/7/2020,Stocks - Wall Street Opens Lower as Jobless Claims Rise for 1st Time Since April
22/7/2020,Wall Street Rallies Into Close as Bulls Find Their Feet on Tech Comeback
22/7/2020,House Republicans want Twitter CEO to testify at tech hearing
22/7/2020,Apple offers modified phones to security researchers looking for iOS weaknesses
22/7/2020,"Italy opens antitrust probe into Amazon, Apple over sale of Beats headphones"
22/7/2020,Apple offers modified phones to security researchers looking for iOS weaknesses
22/7/2020,"Italy opens antitrust probe into Amazon, Apple over sale of Beats headphones"
22/7/2020,How Tesla defined a new era for the global auto industry
21/7/2020,Chinese genetics company BGI denies U.S. human rights accusations
21/7/2020,U.S. stocks mixed at close of trade; Dow Jones Industrial Average up 0.60%
21/7/2020,"S&P 500 turns positive for 2020, but most stocks are missing the party"
21/7/2020,Day Ahead: 3 Things to Watch for July 22
21/7/2020,Dow Gives up Some Gains as Worries Over Stimulus Sours Sentiment
21/7/2020,"Dow Flirts With 27,000 Level as Earnings Delight Feeds Bullish Bets"
21/7/2020,"Apple to remove carbon from supply chain, products by 2030"
21/7/2020,Stocks - Wall Street Opens Higher on Tech Frenzy; Dow up 200 Pts
21/7/2020,Downloads of Japan's COVID-19 app reach 7.7 million in slowing pace since debut
20/7/2020,Exclusive: Mexico eager to lure firms from Asia under new trade deal
20/7/2020,Combined Market Value of All Korean Stocks Is Now Less Than Amazon or Apple
20/7/2020,U.S. stocks higher at close of trade; Dow Jones Industrial Average up 0.03%
20/7/2020,Trump campaign runs Facebook ads on whether TikTok should be banned
20/7/2020,Nasdaq Hits Record High as Amazon Leads Tech to Glory
20/7/2020,Tech shares lead Wall Street higher as potential vaccines show promise
20/7/2020,Dow Off Lows as Bulls Load Up on Tech Amid Vaccine Optimism
20/7/2020,Chipmaker AT&S to invest 120 million euros in expanding production in Austria
20/7/2020,Tech demand powers Taiwan export order growth to two-year high
18/7/2020,G20 finance officials eye solution to digital tax row this year
18/7/2020,Twitter says attackers downloaded data from up to eight non-verified accounts
17/7/2020,Health Tech Firm Draws Zoom Comparison After 270% Jump Since IPO
17/7/2020,Apple to Gain a New Chinese iPhone Maker During a Trade War
17/7/2020,Twitter says about 130 accounts were targeted in cyber attack this week
16/7/2020,Singapore’s Hottest Stock Is Set to Continue Its Winning Streak
16/7/2020,Twitter stepped up search to fill top security job ahead of hack
16/7/2020,Forty-Three Days of Nasdaq Dip Buying May Crater With Netflix
16/7/2020,"Wall Street ends lower on COVID-19 worries, tech weighs"
16/7/2020,Coinbase Lists Algorand (ALGO) in Latest Expansion
16/7/2020,Dow Snaps 4-Day Win Streak as Tech Stumble Offsets Upbeat Earnings
16/7/2020,Dow Shrugs Off Bullish Earnings as Tech Falters
16/7/2020,Conflict Gold Back in Spotlight as Investors Flock to Safe Haven
16/7/2020,"Burger King, GM venture criticised on China consumer rights show"
16/7/2020,U.S. passive stock funds back in demand as investors seek steadier returns
16/7/2020,Apple expands coding education programs to more historically Black schools
16/7/2020,Roth Capital Stick to Their Buy Rating for Glu Mobile
16/7/2020,"Twitter shares stumble after high-profile, unprecedented hack"
16/7/2020,"EU regulators to probe Alexa, Siri and other voice assistants"
16/7/2020,"EU's Vestager says court rulings on Apple taxes, EU data transfer tool are a 'loss'"
15/7/2020,Twitter silences some top accounts after internal systems hacked
15/7/2020,Day Ahead: 3 Things to Watch for July 16
15/7/2020,Dow Notches 4-Day Winning Streak on Positive Vaccine News
15/7/2020,"Dow Eases From Highs, but Positive Vaccine News Keeps Reopening Trade Alive"
15/7/2020,Blow for EU as Apple wins fight against $15 billion tax order
15/7/2020,VW centralises group software development at Audi
15/7/2020,"Apple expands news offerings with audio, local newspaper stories"
15/7/2020,Retail Investors Win Big Again With Hedge Funds Playing Catch-Up
15/7/2020,EU regulators seek feedback on Google's Fitbit data pledge
15/7/2020,EU plans clampdown on pro-corporate tax systems to aid recovery
15/7/2020,"Exclusive: Arm raises prices on chip technology for some customers, sources say"
15/7/2020,"Stocks - Goldman Sachs, Moderna and Apple Gain Premarket"
15/7/2020,"Top 5 Things to Know in the Market on Wednesday, July 15th"
15/7/2020,"Over 2,500 games removed from Apple's China App Store after loophole shuts: data firm"
14/7/2020,Crunch time for Apple in fight against $15 billion EU tax order
14/7/2020,"Wall Street surges, led by energy and materials"
14/7/2020,"Dow Racks Up Gains as Energy Rallies, Tech Rebounds"
14/7/2020,S&P Higher as Tech Recovers From Lows on Signs Cases Flattening in California
14/7/2020,"Crowded trade, high valuations: why investors worry about tech stocks"
14/7/2020,China says U.S. warnings over Xinjiang hurt global supply chain
14/7/2020,"Bill Gross predicts value outperforms growth, based on rates correlation"
14/7/2020,Google offers data pledge in bid to win EU okay for Fitbit buy
14/7/2020,SunTrust Robinson Stick to Their Buy Rating for Yext Inc
13/7/2020,Electric car maker Fisker to go public through SPAC deal at $2.9 billion valuation
13/7/2020,Day Ahead: 3 Things to Watch for July 14
13/7/2020,Apple says full return to offices not until the end of the year: Bloomberg News
13/7/2020,S&P Slashes Gains to End Lower as California Shutdown Triggers Tech U-Turn
13/7/2020,Dow Cuts Some Gains as Tech Stumbles on Reopening Rollbacks
13/7/2020,"Huawei revenue growth slows amid U.S. pressure, expected UK ban"
13/7/2020,"Stocks - Tesla, Pepsico and MGM Resorts Soar in Premarket"
13/7/2020,Smartphone shipments in China fall 16% in June: government data
12/7/2020,Presidential Campaigns and Tiktok: Bad Crypto News of the Week
12/7/2020,"After 133% Rally, SoftBank Investors Bet There’s More to Come"
12/7/2020,Comparing Apple to Bitcoin? Crypto Occupies a Class of Its Own
11/7/2020,Presidential Campaigns and Tiktok: Bad Crypto News of the Week
11/7/2020,Comparing Apple to Bitcoin? Crypto Occupies a Class of Its Own
11/7/2020,"Amazon.com bans, then un-bans TikTok app from employee mobile devices"
10/7/2020,"U.S. slaps French goods with 25% duties in digital tax row, but delays effective date"
10/7/2020,LinkedIn sued over allegation it secretly reads Apple users' clipboard content
10/7/2020,Dow Rides Reopening Trade to Eke Weekly Gain
10/7/2020,"Fed adds Apple, Anheuser-Busch, Expedia to its bond holdings"
10/7/2020,Dow Moves Higher as Positive Vaccine News Renews Bets on Reopening Trade
10/7/2020,"Exclusive: Apple supplier Foxconn to invest $1 billion in India, sources say"
10/7/2020,Japan Display aims to bring some panel production back from China after coronavirus
10/7/2020,TSMC Sales Shine After Virus Drives Demand for Datacenter Chips
9/7/2020,"Dow, S&P 500 fall on fears over virus resurgence but Nasdaq ends at record high"
9/7/2020,"U.S. to announce, but defer, retaliation over French digital tax: USTR"
9/7/2020,Orchid Labs CEO Says New VPN Seeks to Enhance Privacy Rights
9/7/2020,Nasdaq At Record as Investors Bet on Big Tech to Weather Virus Storm; Dow Falls
