Date,Title
18/6/2019,Stocks - Wall Street Surges as Trump to Meet with Xi 
17/6/2019,"StockBeat - Apple 5G iPhone Due in 2020, but Near-Term Growth Cloudy"
17/6/2019,Huawei Braces for Phone Sales Drop of Up to 60 Million Overseas
14/6/2019,Broadcom's $2 billion warning rattles global chip sector
14/6/2019,Wall Street drops as Broadcom warning hits chip stocks
14/6/2019,Explainer: Why is Huawei seeking $1 billion patent deal with Verizon?
14/6/2019,Japan Display says has not received notice about Chinese investment
13/6/2019,Google policy head retools team for global lobbying push
13/6/2019,Trump talks trade with Apple CEO Cook as China dispute looms
13/6/2019,Stocks - Wall Street Rises Despite Oil Tensions 
13/6/2019,Stocks - Wall Street Jumps as Suspected Oil Attack Rises Crude Prices
13/6/2019,Taiwan president wins ruling party's nomination for 2020 election
12/6/2019,Republican senator criticizes potential dual U.S. antitrust tech probes
12/6/2019,Stocks -  Energy Shares Pull Wall Street Lower 
12/6/2019,"The media has a big problem, Reuters Institute says: Who will pay for the news?"
12/6/2019,Top 5 Things to Know in the Market on Wednesday
12/6/2019,LG Elec's 5G phones in doubt as chip deal with Qualcomm set to expire
11/6/2019,"LG Electronics, regulators oppose Qualcomm's effort to put antitrust ruling on hold"
11/6/2019,U.S. antitrust chief says past enforcement could presage new probe of current digital giants
11/6/2019,Cloud computing may put Big Tech ahead in future of video games: Citi
11/6/2019,Apple cancels plans for second data center in Denmark
11/6/2019,Stocks - Dow Rises Towards 7-Day High on Tariff Delay Support
11/6/2019,New chip to let headphones respond to Amazon's Alexa by name
11/6/2019,"Senator Warren urges antitrust chief to recuse himself from Google, Apple probes"
11/6/2019,New chip to let headphones respond to Amazon's Alexa by name
11/6/2019,"Senator Warren urges antitrust chief to recuse himself from Google, Apple probes"
11/6/2019,"Stocks -  Apple, Broadcom, Barnes & Noble Rise Premarket; Beyond Meat Falls"
11/6/2019,Stocks - U.S. Futures Rise as Tariff Delay Continues to Support
11/6/2019,Apple's U.S. iPhones Can All Be Made Outside of China If Needed
11/6/2019,Top 5 Things to Know in the Market on Tuesday
11/6/2019,Foxconn announces leadership overhaul as chairman seeks Taiwan presidency
10/6/2019,Citi launches co-branded credit cards with SE Asia's Grab in push for more customers
10/6/2019,"Foxconn Names iPhone Czar, CFO to Terry Gou's Inner Circle"
10/6/2019,This Chinese Newspaper Editor Is Moving Markets With His Tweets
10/6/2019,Stocks - Wall Street Rises; Investors Happy With Trump Tariffs U-Turn
10/6/2019,More U.S. millennials subscribe to video games than traditional pay TV: survey
10/6/2019,Mega-Cap Tech Stocks Surge for Fifth Day; Microsoft at Record
10/6/2019,Brexit chaos holding back UK tech sector: London mayor
9/6/2019,G20 agrees to wrap up Big Tech tax rules by 2020
8/6/2019,3 Things Under the Radar This Week
7/6/2019,U.S. stocks higher at close of trade; Dow Jones Industrial Average up 1.02%
7/6/2019,"Stocks - Wall Street Rallies on Hopes for Lower Rates, Easing Trade Tensions"
7/6/2019,"Wall St. rallies on hopes of U.S. rate cut, trade progress"
7/6/2019,Microsoft Reclaims $1 Trillion Mark as Stock Climbs to Record
7/6/2019,Stocks - Wall Street Rises as Weak Jobs Report Spurs Rate-Cut Hopes
6/6/2019,Exclusive: Foxconn plans management overhaul as Chairman Gou seeks Taiwan presidency: source
6/6/2019,Stocks - S&P 500 Makes a Late Surge as Trade Tensions Ease
6/6/2019,AT&T eyes $16-$17-a-month streaming service: WSJ
6/6/2019,U.S. FCC makes it easier for phone companies to block 'robocalls'
6/6/2019,Stocks - Wall Street Flat as Trump Hints at More Tariffs After G20
6/6/2019,JPMorgan to shutter its smartphone bank account a year after nationwide launch
6/6/2019,"Barrels of Oil May Be Paid for Using Crypto One Day, Head of Russian Energy Giant Says"
6/6/2019,Explainer: Should Big Tech fear U.S. antitrust enforcers?
5/6/2019,Brazil retailer Via Varejo launches digital bank targeting low-income clients
5/6/2019,Stocks - Techs Rise and Rate-Cut Hopes Boost Market 
5/6/2019,Wall St. climbs as weak private jobs data boost rate cut hopes
5/6/2019,Explainer: U.S.-China trade war - the levers they can pull
5/6/2019,Stocks - Wall Street Rises on Hope that Fed May Cut Rates
5/6/2019,"Google, Facebook have tight grip on growing U.S. online ad market: report"
5/6/2019,"Stocks - Campbell Soup, Apple, Cronos Rise Premarket; GameStop Slumps"
5/6/2019,"Play the game, save the planet: Conservationists target video gamers"
5/6/2019,Stocks - U.S. Futures Extend Rally on Rate Cut Hopes
5/6/2019,"Trade war, weak growth to test G20 finance leaders' economic optimism"
4/6/2019,"Apple asks developers to place its login button above Google, Facebook"
4/6/2019,GameStop halts dividend as console sales slow; shares fall 26%
4/6/2019,U.S. stocks higher at close of trade; Dow Jones Industrial Average up 2.06%
4/6/2019,Stock - Wall Street Surges on Powell's Promises
4/6/2019,Developers sue Apple over App Store practices
4/6/2019,Stocks - Wall Street Rises as Possibility of Fed Rate Cut in Focus
4/6/2019,"Apple CEO says U.S. scrutiny 'fair,' but rejects idea company is a monopoly"
4/6/2019,Uber says IRS probing its 2013-14 tax returns
4/6/2019,Apple to Unveil ‘CryptoKit’ Cryptographic Developer Package at Upcoming Conference
4/6/2019,Stocks - U.S. Futures Rise as Fed’s Bullard Points to Possible Rate Cut
4/6/2019,"Comic: Bullseye on Big Tech: Trump Makes Good on His Threat to Go After Google, Amazon"
4/6/2019,Stocks - U.S. Futures Rise as Fed’s Bullard Points to Possible Rate Cut
4/6/2019,"Comic: Bullseye on Big Tech: Trump Makes Good on His Threat to Go After Google, Amazon"
4/6/2019,Taiwan says 'unrepentant' China covering up June 4 Tiananmen crackdown
4/6/2019,Tech sell-off spreads to Europe after U.S. antitrust moves
4/6/2019,World's biggest firms foresee $1 trillion climate cost hit
3/6/2019,Alphabet shares slide 6% on possible DoJ antitrust probe
3/6/2019,U.S. moving toward major antitrust probe of tech giants
3/6/2019,"U.S. probe of Google's online ad dominance would appease long suffering rivals, publishers"
3/6/2019,"Apple touts privacy in web sign-on war with Facebook, Google"
3/6/2019,Explainer: U.S. dependence on China's rare earth - Trade war vulnerability
3/6/2019,House panel to probe competition in digital markets
3/6/2019,Exclusive: U.S. Justice Dept considering Apple probe - sources
3/6/2019,Apple dips on news of DoJ antitrust probe
3/6/2019,EU wants to hear from Apple over Spotify complaint
3/6/2019,"Stocks - Boeing, FedEx, Amazon Fall Premarket; Humana Rises"
3/6/2019,Top 5 Things to Know in the Market on Monday
31/5/2019,"Bitwise Calls Out to SEC: 95% of Bitcoin Trade Volume Is Fake, Real Market Is Organized"
31/5/2019,Stocks - Wall Street Falls as Trump Threatens Tariffs on Mexico  
31/5/2019,Stocks- Dow Futures Slump as Trump Threatens Tariffs on Mexico
31/5/2019,"China consumers sour as fruit prices soar on weather, trade war"
31/5/2019,"Exclusive: Amazon interested in buying Boost from T-Mobile, Sprint - sources"
30/5/2019,"Apple Shares Have Near-Term Floor at $160, Morgan Stanley Says"
30/5/2019,"Japan Display gets debt relief, says consortium to formalize bailout"
30/5/2019,"China Waits for U.S. to Make Next Move, Days After Trump Says He’s in No Rush"
30/5/2019,Explainer: China's rare earth supplies could be vital bargaining chip in U.S. trade war
29/5/2019,China set to control rare earth supply for years due to processing dominance
29/5/2019,Stocks - S&P Slumps as China's Rare-Earth Threat Buries Shares
29/5/2019,Google bans apps that facilitate sale of marijuana
29/5/2019,Apple defends App Store amid mounting criticism
29/5/2019,U.S. Risks ‘Devastating’ Blow From China’s Rare Earths Monopoly
29/5/2019,MediaTek aims to take on Qualcomm with new 5G chip
28/5/2019,Qualcomm asks U.S. judge to put anti-trust ruling on hold while chipmaker appeals
28/5/2019,Payback Time: How China Could Retaliate for U.S. Huawei Ban
28/5/2019,Pegatron eyes up to $1 billion Indonesia investment to assemble Apple phone chips: deputy minister
28/5/2019,Huawei holds on to No. 2 smartphone spot in first quarter: report
28/5/2019,Ireland reappoints regulator overseeing tech giants for another term
28/5/2019,StockBeat - Roku Slides as JPMorgan Warns of 'Near-Term Risks' Amid Recent Surge
28/5/2019,Stocks - Wall Street Rises Even as Trade Worries Continue
28/5/2019,Top 5 Things to Know in The Market on Tuesday
28/5/2019,China dreams on hold: heartland city feels chill of economic slowdown
25/5/2019,3 Things Under the Radar This Week
24/5/2019,Huawei shipments could fall by up to a quarter this year: analysts
24/5/2019,Wall St. edges higher after Trump sparks U.S.-China trade hopes
24/5/2019,Irish regulator opens first privacy probe into Google
23/5/2019,"Stocks - Wall Street Plunges on Trade, Growth Worries "
23/5/2019,Stocks - Wall Street Slumps as Trade War Fears Escalate
23/5/2019,Stocks- U.S. Futures Slump as Trade War Impact Spreads to Europe
23/5/2019,ARM supply halt deals fresh blow to Chinese tech giant Huawei
22/5/2019,Explainer: China's rare earth supplies could be vital bargaining chip in U.S. trade war
22/5/2019,U.S. stocks lower at close of trade; Dow Jones Industrial Average down 0.39%
22/5/2019,"U.S. judge says Qualcomm violated antitrust law; appeal planned, shares plunge"
22/5/2019,Apple's Webkit to launch new privacy feature for ad tracking
22/5/2019,"Yet to show its teeth, landmark EU privacy law already a global standard"
22/5/2019,Apple more upfront with iPhone users on battery health: UK watchdog
22/5/2019,Carriers Begin Dropping Huawei Handsets as U.S. Crackdown Bites
22/5/2019,Huawei Woes Widen as Asian Carriers Begin Dropping Its Handsets
22/5/2019,"Sony sees smartphone business as indispensable, says CEO"
21/5/2019,U.S. stocks higher at close of trade; Dow Jones Industrial Average up 0.77%
21/5/2019,Apple expands keyboard repairs to newer models of MacBook
21/5/2019,U.S. eases curbs on Huawei; founder says clampdown underestimates Chinese firm
21/5/2019,Apple expands keyboard repairs to newer models of MacBook
21/5/2019,U.S. eases curbs on Huawei; founder says clampdown underestimates Chinese firm
21/5/2019, Stocks- Dow Recovers as U.S. Eases Huawei Restrictions for Now
21/5/2019,Hong Kong leader presses on with extradition bill undeterred by critics
20/5/2019,Trump Ban Puts Huawei's Smartphone Plans in Jeopardy
20/5/2019,"In inland Chinese province, property bubble haunts dreams of prosperity"
20/5/2019,U.S. stocks lower at close of trade; Dow Jones Industrial Average down 0.33%
20/5/2019,Huawei mobile users ponder switching brand after Google news
20/5/2019,Stocks - S&P Stumbles as Huawei Ban Sends Chip Stocks Spiraling Lower 
20/5/2019,Wall St. pressured as Huawei fallout hits tech shares
20/5/2019,StockBeat -  Apple Slumps as Analysts Warn of U.S.-China Trade Turmoil  
20/5/2019,"U.S., China bicker over 'extravagant expectations' on trade deal"
20/5/2019,"Stocks - Nasdaq Drags Wall Street Down on Huawei, Trade Fears"
20/5/2019,Apple Falls 4%
20/5/2019,JPMorgan's quant guru breaks down the market's ace in the hole for fighting Trump's trade war — and explains why stocks could surge 12%
20/5/2019,Chips are down: Huawei U.S. blacklisting knocks semiconductor stocks
20/5/2019,"Stocks -  Alphabet, Tesla, Apple Fall Premarket Amid Trade Fears"
20/5/2019,Stocks- Nasdaq Futures Slump as Tech Companies Boycott Huawei
20/5/2019,China's farm stocks defy Sino-U.S. trade rout on local demand expectations
17/5/2019,Walmart bets big on attracting workforce with new HQ campus
16/5/2019,"Huawei ban clouds U.S.-China trade talks, tech sector"
16/5/2019,Reinventing Germany's Economy
16/5/2019,Macron takes aim at U.S. in push for fairer tech industry
16/5/2019,Huawei's $105 billion business at stake after U.S. broadside
16/5/2019,"As 'Big Bang Theory' ends, will Sheldon get his Nobel Prize?"
16/5/2019,"Stocks - Wall Street Surges After Strong Walmart, Cisco Earnings"
16/5/2019,"U.S.-China trade tensions hit Japanese robot, construction stocks"
15/5/2019,Tesla to update battery software following car fires
15/5/2019,The Chinese Stocks Most Exposed to Escalating U.S. Tariffs
15/5/2019,"Cisco beats earnings target, says has cushioned supply chain from tariffs"
15/5/2019,The Chinese Stocks Most Exposed to Escalating U.S. Tariffs
15/5/2019,"Cisco beats earnings target, says has cushioned supply chain from tariffs"
15/5/2019,Big U.S. hedge funds regain ardor for FAANGs in first quarter: filings
15/5/2019,Buffett's Berkshire unveils $861 million Amazon stake
14/5/2019,Asian Markets Rise; Trump Urges Fed to Cut Rate to Win Trade War
14/5/2019,"Apple supplier Japan Display mulling cutting around 1,000 jobs: Nikkei"
14/5/2019,U.S. actor Tim Conway of 'The Carol Burnett Show' dies at age 85
14/5/2019,"Disney takes control of Hulu to challenge Netflix, Amazon"
14/5/2019,"Deere, Apple, Retail in Focus as U.S. Releases Fresh Tariff List"
14/5/2019,"Stocks - Coca-Cola Gains in Premarket, Uber, Apple, Tesla Rebound"
14/5/2019,Tesla car catches fire in Hong Kong parking lot: media
13/5/2019,Asian Stocks Fall as China Hits Back at Trump
13/5/2019,Investors brace portfolios for longer U.S.-China trade war
13/5/2019,U.S. stocks lower at close of trade; Dow Jones Industrial Average down 2.38%
13/5/2019,"In setback for Apple, U.S. Supreme Court lets App Store antitrust suit proceed"
13/5/2019,Twitter accidentally shares user location data with advertising partner
13/5/2019,Stocks - Day of Reckoning Hits Stocks as U.S.-China Trade War Escalates
13/5/2019,Wall Street shudders as U.S.-China trade war intensifies
13/5/2019,Apple revamps its TV app ahead of streaming service launch
13/5/2019,Stocks - Wall Street Slides as China Increases Tariffs in Trade Retaliation
13/5/2019,"Stocks - FAANGs Slide in Premarket, Teva Sinks, Uber Extends Losses"
13/5/2019,Chinese group to delay bailout funding for Apple supplier Japan Display
13/5/2019,Tencent's PUBG replacement 'Game for Peace' rakes in $14 million in 72 hours
10/5/2019,Trade-sensitive stocks on ropes as uncertainty weighs
10/5/2019,U.S. stocks higher at close of trade; Dow Jones Industrial Average up 0.44%
10/5/2019,Stocks - Wall Street Ends Higher Amid Trade Confusion
10/5/2019,Foxconn's Gou to keep board seat as he bids for Taiwan's presidency
10/5/2019,‘I’m Not Apple’: Small Businesses Squeezed by Trump’s Tariffs
9/5/2019,U.S. stocks lower at close of trade; Dow Jones Industrial Average down 0.54%
9/5/2019,Stocks - Wall Street Posts Loss on Bets U.S.-China Trade War Keeps Going
9/5/2019,U.S. stocks lower at close of trade; Dow Jones Industrial Average down 0.54%
9/5/2019,Stocks - Wall Street Posts Loss on Bets U.S.-China Trade War Keeps Going
9/5/2019,"U.S. adults are spending big on video games, playing mostly on smartphones"
9/5/2019,"Damaged by Brexit, EU heads to show united front at Romania meeting"
9/5/2019,Chinese tech firms' search for growth seen boosting costs in March quarter
8/5/2019,Goldman Sachs Favors Microsoft Over Apple Amid Trade War
8/5/2019,Stocks - Wall Street Struggles to Break 3-Day Losing Streak over Trade Woes
8/5/2019,"As Uber gears up for IPO, many Indian drivers talk of shattered dreams"
7/5/2019,Golf: Koepka uses visit to the Big D to prepare for Big Apple
7/5/2019,U.S. stocks lower at close of trade; Dow Jones Industrial Average down 1.79%
7/5/2019,Wall Street slides as U.S.-China trade fears rise
7/5/2019,"Google launches $399 Pixel phone, more U.S. carriers will sell it"
7/5/2019,Apple teams up with SAP to help clients develop iPhone business apps
6/5/2019,U.S. stocks lower at close of trade; Dow Jones Industrial Average down 0.25%
6/5/2019,Trump's China tariff threat sends Wall St. lower
6/5/2019,Sinclair CEO sees possible deals with Amazon and others seeking live sports
6/5/2019,Stocks Pare Losses After Shock From Trump's Tweets: Markets Wrap
6/5/2019,Google set to launch privacy tools to limit online tracking: WSJ
6/5/2019,Warren Buffett says U.S.-China trade war would be 'bad for the whole world'
6/5/2019,Stocks - Dow Plummets Nearly 400 Points as Trade Worries Spook Wall Street
6/5/2019,"Stocks - Kraft Falls in Premarket, Apple, Boeing, Tesla Slide, Anadarko Jumps"
6/5/2019,Wall Street Wonders Whether Trump's Tariff Is a Tactic. Or Not.
6/5/2019,Stocks - U.S. Futures Tumble as Trump Breaks Trade Truce
6/5/2019,"Foxconn's Gou wants to be peacemaker between U.S., China and Taiwan"
4/5/2019,3 Things Under the Radar This Week
3/5/2019,EU's Tusk warns of risks in rise of U.S. tech giants
3/5/2019,Take Five: Vol squall coming? World markets themes for the week ahead
3/5/2019,"Norway's wealth fund made record returns in first quarter, looking at Uber IPO"
2/5/2019,U.S. Justice Department asks for hearing in Qualcomm antitrust case
2/5/2019,"Buffett says Berkshire Hathaway, finally, has invested in Amazon.com: CNBC"
2/5/2019,Huawei Overtakes Apple to Become Second Biggest Smartphone Maker
2/5/2019,"Facebook bans Alex Jones, other extremist figures"
2/5/2019,Foxconn chairman Gou meets with Trump on Wisconsin project
2/5/2019,Quantcast latest tech company to face Irish privacy probe
2/5/2019,Wall Street Opens Flat to Lower in Subdued Trade
2/5/2019,"Stocks: Tesla Soars, Shell, Cigna Rise in Premarket; Eventbrite Slumps"
2/5/2019,Stocks - U.S. Futures Set to Bounce Back After Fed Disappointment
1/5/2019,Qualcomm hangs on to most Apple gains after earnings report
1/5/2019,"Option notebook: Titans decline Conklin, Bills decline Lawson"
1/5/2019,Apple's upbeat forecast pushes market value back toward $1 trillion
1/5/2019,Stocks - S&P Tumbles as Powell Hurts Rate Cut Hopes
1/5/2019,Fitbit results beat Street as demand for wearable devices climb
1/5/2019,U.S. stocks lower at close of trade; Dow Jones Industrial Average down 0.61%
1/5/2019,Wall Street drops after Fed chair dampens rate-cut hopes
1/5/2019,Gold Dips Ahead of Fed
1/5/2019,U.S. Stocks Mixed Before Fed as Treasuries Rally
1/5/2019,Stocks - Wall Street Opens Higher Boosted by Strong Apple Gains
1/5/2019,Apple Rises 5%
1/5/2019,"Stocks - Apple, AMD, CVS Surge in Premarket; Yum!, Shopify Fall"
1/5/2019,Stocks - U.S. Futures Set to Open Higher After Apple Boost
30/4/2019,"In streaming wars, Apple says it can coexist with Netflix"
30/4/2019,"Apple optimistic as accessories, iPhone price cuts help China sales"
30/4/2019,S&P 500 posts best four-month run in nearly nine years; Apple jumps after hours
30/4/2019,Stocks - Alphabet and Apple Hold Techs Back; Stocks End Mixed
30/4/2019,U.S. stocks mixed at close of trade; Dow Jones Industrial Average up 0.15%
30/4/2019,Apple Beats on Top and Bottom Lines; Shares Climb
30/4/2019,Day Ahead: Top 3 Things to Watch
30/4/2019,Frothy markets turn dealmaker Warren Buffett into a bankroller
30/4/2019,Oprah 'quietly figuring out' how to wield her political clout in 2020
30/4/2019,Foxconn chairman travels to White House to discuss Wisconsin: source
30/4/2019,Oprah 'quietly figuring out' how to wield her political clout in 2020
30/4/2019,Foxconn chairman travels to White House to discuss Wisconsin: source
30/4/2019,Stocks - Wall Street Mixed; Pharma Earnings Offset Alphabet Miss
30/4/2019,Czech finance ministry plans 7 percent rate for new digital tax
30/4/2019,"Chipmaker AMS signals steady Apple orders, Android share grows"
30/4/2019,Equities drop after China data; euro zone growth lifts single currency
30/4/2019,Stocks - U.S. Futures Hover Close to Highs on Mixed Data; Fed Eyed
30/4/2019,Top 5 Things to Know in the Market on Tuesday
30/4/2019,Samsung Electronics bets on better second-half after first-quarter profit slumps
30/4/2019,European shares fall as growth worries linger; AMS rises
29/4/2019,"S&P 500 posts high, extends 2019 rally; Alphabet falls late"
29/4/2019,Is Buffett still a buy? Wall Street splits on Berkshire Hathaway as annual meeting looms
29/4/2019,Spotify jumps as its number of paid subscribers soars to 100 million
29/4/2019,"Spotify hits 100 million subscribers, reports revenue jump"
28/4/2019,Economic Calendar - Top 5 Things to Watch This Week
26/4/2019,"Intel puts modem business up for sale, held talks with Apple: WSJ"
26/4/2019,"Sony flags disappointing profit, scraps targets as gaming slows"
26/4/2019,Top 5 Things to Know in the Market on Friday
25/4/2019,Intel cuts forecast as China data center sales remain weak
25/4/2019,Day Ahead: Top 3 Things to Watch
25/4/2019,Intel cuts forecast as China data center sales remain weak
25/4/2019,Day Ahead: Top 3 Things to Watch
25/4/2019,Intel Shares Slump on Weak Second-Quarter Guidance
25/4/2019,"After years serving CEOs, Goldman's Ayco also wants other workers"
25/4/2019,"Microsoft market cap touches $1 trillion, pulls above Apple"
25/4/2019,Irish regulator opens inquiry into Facebook over password storage
25/4/2019,"Microsoft Poised to Top $1 Trillion in Value, Beating Amazon and Apple"
25/4/2019,Spotify loses access to major Indian label
24/4/2019,"LG Electronics to shut South Korea phone plant, move production to Vietnam"
24/4/2019,Microsoft tops $1 trillion as it predicts more cloud growth
24/4/2019,"Chipmaker ASM beats first-quarter targets, sees market outperformance in 2019"
24/4/2019,Indian court moves to lift ban on Chinese video app TikTok
24/4/2019,"Stocks - Wall Street Flat After Boeing, Caterpillar Earnings"
24/4/2019,Exclusive: Behind Airbnb's bet on show business to hook travelers
24/4/2019,Technology ethics campaigners offer plan to fight 'human downgrading'
23/4/2019,Japan's New Era Comes After Three Decades of Economic Change
23/4/2019,"Snap restarts user growth with original shows, Android overhaul"
23/4/2019,"Snap Tops Forecasts, Jumps More After Hours"
23/4/2019,"Stocks - Nasdaq, S&P Notch Record Closes as Earnings Bonanza Fuels Rally"
23/4/2019,Will Netflix Junk Bonds Wilt Amid the Content Wars?
23/4/2019,China's Tencent backs Argentina mobile banking startup Uala
23/4/2019,S&P 500's Path to Record Goes Through Favorable Tech Setup
23/4/2019,"Exclusive: China's Bytedance says India TikTok ban causing $500,000 daily loss, risks jobs"
22/4/2019,Samsung delays Galaxy Fold phone launch over screen problems
22/4/2019,"Weak tech demand shrinks Taiwan export orders, rebound tipped in third-quarter"
21/4/2019,Samsung Electronics delays Galaxy Fold media events in China
19/4/2019,"CV Market Watch™: Weekly Crypto Trading Overview (April 12-19, 2019)"
19/4/2019,Mir card payment system looks beyond Russia
19/4/2019,Foxconn says it remains committed to Wisconsin investment project
18/4/2019,"Google lets Android users in Europe choose rival browsers, search engines"
18/4/2019,New Apple lab uses robots to rip apart devices for recycling materials
18/4/2019,Foxconn's Gou's close China links could weigh on Taiwan election chances
18/4/2019,"U.S. says China steps up campaign to influence Taiwan, including vote"
18/4/2019,TSMC upbeat on chip outlook after Apple-Qualcomm settlement; first quarter disappoints
18/4/2019,"Samsung gets reports of Galaxy Fold screen problems, raising specter of Note 7 fiasco"
17/4/2019,"Explainer: How 5G drove moves by Apple, Qualcomm and Intel"
17/4/2019,Wisconsin governor says he wants to renegotiate Foxconn contract
17/4/2019,Stocks - Dow Flat as Health Care Stocks Slump Amid Fears Over Reforms
17/4/2019,Facebook working on voice assistant to rival Amazon's Alexa
17/4/2019,U.S. chipmakers' shares rally despite demand uncertainty
17/4/2019,Qualcomm gains $30 billion in market value after Apple settlement
17/4/2019,Wall Street flat as healthcare decline counters chip boost
17/4/2019,Qualcomm rockets higher by another 10% — extending the gains from its settlement with Apple
17/4/2019,"Stocks - Wall Street Mixed After Pepsi, Morgan Stanley Earnings"
17/4/2019,Video app TikTok's India download ban worries wider tech industry
17/4/2019,"T-Mobile, Comcast launch anti-robocalling feature, claim industry's first"
17/4/2019,"EU unfair practices digital rules put spotlight on Google, Amazon, Facebook"
17/4/2019,Exclusive: Apple in talks with potential suppliers of sensors for self-driving cars - sources
17/4/2019,"Stocks -  Netflix, Pepsi, Qualcomm Rise Premarket; Sprint Falls"
17/4/2019,China Is Considering Stimulus Measures to Boost Consumption
17/4/2019,Stocks - U.S. Futures Inch Up on Chinese Growth Surprise
17/4/2019,"TomTom results top estimates, wins two high-definition map deals"
17/4/2019,European shares ease from eight-month high as miners weigh
17/4/2019,Top 5 Things to Know in the Market on Wednesday
17/4/2019,"Foxconn's Gou in bid for Taiwan presidency, with blessing of sea goddess"
17/4/2019,"TikTok vanishes from Google, Apple app stores in India after ban"
17/4/2019,Qualcomm stock jumps 23 percent on surprise settlement with Apple
16/4/2019,"Fried chicken vs $13: Apple, Qualcomm explain claims to jury as trial opens"
16/4/2019,Netflix forecast disappoints as streaming competition looms
16/4/2019,Stocks - Dow Ends Higher on Earnings Optimism  
16/4/2019,Netflix forecast disappoints as streaming competition looms
16/4/2019,Stocks - Dow Ends Higher on Earnings Optimism  
16/4/2019,"Huawei says not discussed 5G chipsets with Apple, wins more telco gear contracts"
16/4/2019,"Foxconn's Gou says may run for Taiwan president, step back from daily business"
15/4/2019,Goldman Sachs Embarks on a Long Evolutionary Path
15/4/2019,"Apple, allies seek billions in U.S. trial testing Qualcomm's business model"
15/4/2019,Spotify takes a hit after report says Amazon is exploring a free music service
15/4/2019,Exclusive: Foxconn chairman Gou aims to step down to pave way for younger talent
12/4/2019,Chinese group to get control of Japan Display after $2.1 billion bailout
12/4/2019,"As parents consider new streaming services, is there too much children's programming?"
