Date,Title,Text,Processed Title,Processed Text,Sentiment Title,Sentiment Text,Positive Title,Positive Text
2019-02-20,Top 5 Things to Watch in Markets in the Week Ahead,"By Karen Pierog
CHICAGO (Reuters) - Illinois' new governor, J.B. Pritzker, on Wednesday proposed a nearly $39 billion fiscal 2020 general funds budget that he said will serve as a...",top 5 things to watch in markets in the week ahead,"by karen pierog chicago reuters  illinois new governor jb pritzker on wednesday proposed a nearly 39 billion fiscal 2020 general funds budget that he said will serve as a","{'neg': 0.0, 'neu': 0.833, 'pos': 0.167, 'compound': 0.2023}","{'neg': 0.0, 'neu': 1.0, 'pos': 0.0, 'compound': 0.0}",True,False
2019-02-17,Top 5 Things to Watch in Markets in the Week Ahead,"By David Shepardson and Sarah N. Lynch
WASHINGTON (Reuters) - U.S. Transportation Department Deputy Secretary Jeffrey Rosen is the leading candidate to replace Rod Rosenstein as...",top 5 things to watch in markets in the week ahead,"by david shepardson and sarah n lynch washington reuters  us transportation department deputy secretary jeffrey rosen is the leading candidate to replace rod rosenstein as","{'neg': 0.0, 'neu': 0.833, 'pos': 0.167, 'compound': 0.2023}","{'neg': 0.0, 'neu': 1.0, 'pos': 0.0, 'compound': 0.0}",True,False
2019-02-14,Top 5 Things to Watch in Markets in the Week Ahead,"By Amanda Becker
WASHINGTON (Reuters) - Senator Elizabeth Warren issued a pointed campaign finance challenge to fellow Democratic U.S. presidential contenders at her official 2020...",top 5 things to watch in markets in the week ahead,"by amanda becker washington reuters  senator elizabeth warren issued a pointed campaign finance challenge to fellow democratic us presidential contenders at her official 2020","{'neg': 0.0, 'neu': 0.833, 'pos': 0.167, 'compound': 0.2023}","{'neg': 0.0, 'neu': 0.944, 'pos': 0.056, 'compound': 0.0772}",True,True
2019-02-14,Dow Futures Move Higher As Investors Brace for Earnings,"By Humeyra Pamuk
WASHINGTON (Reuters) - Five Republican senators are warning President Donald Trump's new pick to run the Environmental Protection Agency, Andrew Wheeler, that...",dow futures move higher as investors brace for earnings,"by humeyra pamuk washington reuters  five republican senators are warning president donald trumps new pick to run the environmental protection agency andrew wheeler that","{'neg': 0.0, 'neu': 1.0, 'pos': 0.0, 'compound': 0.0}","{'neg': 0.094, 'neu': 0.906, 'pos': 0.0, 'compound': -0.34}",False,False
2019-02-13,Top 5 Things to Watch in Markets in the Week Ahead,"By Sharon Bernstein
SACRAMENTO, Calif. (Reuters) - California Governor Gavin Newsom said on Tuesday he would scale back massive water and rail projects pushed by his predecessor...",top 5 things to watch in markets in the week ahead,"by sharon bernstein sacramento calif reuters  california governor gavin newsom said on tuesday he would scale back massive water and rail projects pushed by his predecessor","{'neg': 0.0, 'neu': 0.833, 'pos': 0.167, 'compound': 0.2023}","{'neg': 0.0, 'neu': 1.0, 'pos': 0.0, 'compound': 0.0}",True,False
2019-02-12,Top 5 Things to Watch in Markets in the Week Ahead,"By Jennifer Ablan
(Reuters) - Former Federal Reserve Chairman Paul Volcker warned the Trump administration’s handling of domestic issues as well as trade talks with China is...",top 5 things to watch in markets in the week ahead,"by jennifer ablan reuters  former federal reserve chairman paul volcker warned the trump administrations handling of domestic issues as well as trade talks with china is","{'neg': 0.0, 'neu': 0.833, 'pos': 0.167, 'compound': 0.2023}","{'neg': 0.074, 'neu': 0.851, 'pos': 0.074, 'compound': 0.0}",True,False
2019-02-11,Top 5 Things to Watch in Markets in the Week Ahead,"By Richard Cowan and Doina Chiacu
WASHINGTON (Reuters) - Talks on border security funding collapsed after Democratic and Republican lawmakers clashed over immigrant detention...",top 5 things to watch in markets in the week ahead,"by richard cowan and doina chiacu washington reuters  talks on border security funding collapsed after democratic and republican lawmakers clashed over immigrant detention","{'neg': 0.0, 'neu': 0.833, 'pos': 0.167, 'compound': 0.2023}","{'neg': 0.17, 'neu': 0.741, 'pos': 0.089, 'compound': -0.296}",True,False
2019-02-06,Top 5 Things to Watch in Markets in the Week Ahead,"By David Lawder
WASHINGTON (Reuters) - Senior U.S. and Chinese officials are poised to start another round of trade talks in Beijing next week to push for a deal to protect...",top 5 things to watch in markets in the week ahead,"by david lawder washington reuters  senior us and chinese officials are poised to start another round of trade talks in beijing next week to push for a deal to protect","{'neg': 0.0, 'neu': 0.833, 'pos': 0.167, 'compound': 0.2023}","{'neg': 0.0, 'neu': 0.854, 'pos': 0.146, 'compound': 0.5574}",True,True
2019-02-05,Top 5 Things to Watch in Markets in the Week Ahead,"By James Oliphant
WASHINGTON (Reuters) - U.S. Representative Tulsi Gabbard, an Iraq War veteran who at times has had a spiky relationship with the Democratic Party, on Saturday...",top 5 things to watch in markets in the week ahead,"by james oliphant washington reuters  us representative tulsi gabbard an iraq war veteran who at times has had a spiky relationship with the democratic party on saturday","{'neg': 0.0, 'neu': 0.833, 'pos': 0.167, 'compound': 0.2023}","{'neg': 0.127, 'neu': 0.784, 'pos': 0.088, 'compound': -0.296}",True,False
2019-02-04,Dow Futures Move Higher As Investors Brace for Earnings,"By Jason Lange and Idrees Ali
(Reuters) - Virginia Governor Ralph Northam on Saturday resisted mounting pressure from his Democratic party that he resign, denying that he appeared...",dow futures move higher as investors brace for earnings,"by jason lange and idrees ali reuters  virginia governor ralph northam on saturday resisted mounting pressure from his democratic party that he resign denying that he appeared","{'neg': 0.0, 'neu': 1.0, 'pos': 0.0, 'compound': 0.0}","{'neg': 0.214, 'neu': 0.703, 'pos': 0.083, 'compound': -0.5106}",False,False
2019-01-29,Top 5 Things to Watch in Markets in the Week Ahead,"By Susan Cornwell and David Shepardson
WASHINGTON (Reuters) - President Donald Trump expressed skepticism on Sunday that U.S. lawmakers seeking to avoid another government...",top 5 things to watch in markets in the week ahead,"by susan cornwell and david shepardson washington reuters  president donald trump expressed skepticism on sunday that us lawmakers seeking to avoid another government","{'neg': 0.0, 'neu': 0.833, 'pos': 0.167, 'compound': 0.2023}","{'neg': 0.167, 'neu': 0.833, 'pos': 0.0, 'compound': -0.4939}",True,False
2019-01-27,Top 5 Things to Watch in Markets in the Week Ahead,"By Steve Holland and Jeff Mason
WASHINGTON (Reuters) - President Donald Trump, who famously vowed to negotiate big deals in the White House, came out of a government shutdown...",top 5 things to watch in markets in the week ahead,"by steve holland and jeff mason washington reuters  president donald trump who famously vowed to negotiate big deals in the white house came out of a government shutdown","{'neg': 0.0, 'neu': 0.833, 'pos': 0.167, 'compound': 0.2023}","{'neg': 0.0, 'neu': 1.0, 'pos': 0.0, 'compound': 0.0}",True,False
2019-01-24,Top 5 Things to Watch in Markets in the Week Ahead,"By Timothy Gardner
WASHINGTON (Reuters) - Republicans on the U.S. nuclear power regulator approved a stripped down safety rule on Thursday that removes the need for nuclear plants...",top 5 things to watch in markets in the week ahead,"by timothy gardner washington reuters  republicans on the us nuclear power regulator approved a stripped down safety rule on thursday that removes the need for nuclear plants","{'neg': 0.0, 'neu': 0.833, 'pos': 0.167, 'compound': 0.2023}","{'neg': 0.0, 'neu': 0.811, 'pos': 0.189, 'compound': 0.6808}",True,True
2019-01-23,Top 5 Things to Watch in Markets in the Week Ahead,"By David Shepardson
WASHINGTON (Reuters) - The U.S. Transportation Security Administration said on Wednesday it will extend some benefits to 51,000 airport security screeners who...",top 5 things to watch in markets in the week ahead,"by david shepardson washington reuters  the us transportation security administration said on wednesday it will extend some benefits to 51000 airport security screeners who","{'neg': 0.0, 'neu': 0.833, 'pos': 0.167, 'compound': 0.2023}","{'neg': 0.0, 'neu': 0.687, 'pos': 0.313, 'compound': 0.7964}",True,True
2019-01-17,Top 5 Things to Watch in Markets in the Week Ahead,"By Daniel Wiessner
NEW YORK (Reuters) - A lawsuit filed by a federal employees' union over the current U.S. government shutdown cannot move forward because the Justice Department...",top 5 things to watch in markets in the week ahead,"by daniel wiessner new york reuters  a lawsuit filed by a federal employees union over the current us government shutdown cannot move forward because the justice department","{'neg': 0.0, 'neu': 0.833, 'pos': 0.167, 'compound': 0.2023}","{'neg': 0.067, 'neu': 0.813, 'pos': 0.12, 'compound': 0.3612}",True,True
2019-01-16,Top 5 Things to Watch in Markets in the Week Ahead,"By Ginger Gibson
WASHINGTON (Reuters) - The U.S. House of Representatives voted overwhelmingly on Tuesday to pass a resolution disapproving statements made by Representative Steve...",top 5 things to watch in markets in the week ahead,"by ginger gibson washington reuters  the us house of representatives voted overwhelmingly on tuesday to pass a resolution disapproving statements made by representative steve","{'neg': 0.0, 'neu': 0.833, 'pos': 0.167, 'compound': 0.2023}","{'neg': 0.064, 'neu': 0.936, 'pos': 0.0, 'compound': -0.128}",True,False
2019-01-15,Top 5 Things to Watch in Markets in the Week Ahead,"By Gina Cherelus
(Reuters) - An Alabama judge has voided a 2017 state law preventing the removal or alteration of historic memorials, saying it infringed citizens' free-speech...",top 5 things to watch in markets in the week ahead,"by gina cherelus reuters  an alabama judge has voided a 2017 state law preventing the removal or alteration of historic memorials saying it infringed citizens freespeech","{'neg': 0.0, 'neu': 0.833, 'pos': 0.167, 'compound': 0.2023}","{'neg': 0.044, 'neu': 0.956, 'pos': 0.0, 'compound': -0.0258}",True,False
2019-01-15,Dow Futures Move Higher As Investors Brace for Earnings,"By Steve Holland
WASHINGTON (Reuters) - U.S. Treasury Secretary Steven Mnuchin and Secretary of State Mike Pompeo will lead the American delegation to the World Economic Forum in...",dow futures move higher as investors brace for earnings,"by steve holland washington reuters  us treasury secretary steven mnuchin and secretary of state mike pompeo will lead the american delegation to the world economic forum in","{'neg': 0.0, 'neu': 1.0, 'pos': 0.0, 'compound': 0.0}","{'neg': 0.0, 'neu': 0.935, 'pos': 0.065, 'compound': 0.2023}",False,True
2019-01-14,Top 5 Things to Watch in Markets in the Week Ahead,"By Patricia Zengerle
WASHINGTON (Reuters) - The U.S. Senate will begin voting on Tuesday on a resolution criticizing the Trump administration's decision to ease sanctions on...",top 5 things to watch in markets in the week ahead,"by patricia zengerle washington reuters  the us senate will begin voting on tuesday on a resolution criticizing the trump administrations decision to ease sanctions on","{'neg': 0.0, 'neu': 0.833, 'pos': 0.167, 'compound': 0.2023}","{'neg': 0.093, 'neu': 0.815, 'pos': 0.093, 'compound': 0.0}",True,False
2019-01-14,Dow Futures Move Higher As Investors Brace for Earnings,"By Karen Pierog
CHICAGO (Reuters) - Billionaire political newcomer J.B. Pritzker took office as Illinois governor on Monday, pledging to pass a balanced budget and take on the...",dow futures move higher as investors brace for earnings,"by karen pierog chicago reuters  billionaire political newcomer jb pritzker took office as illinois governor on monday pledging to pass a balanced budget and take on the","{'neg': 0.0, 'neu': 1.0, 'pos': 0.0, 'compound': 0.0}","{'neg': 0.0, 'neu': 1.0, 'pos': 0.0, 'compound': 0.0}",False,False
2019-01-14,Oil Rises as OPEC+ Members Voice Support For Supply Cut,"By Lawrence Hurley
WASHINGTON (Reuters) - The U.S. Supreme Court on Monday stayed out of the fight over whether President Donald Trump's appointment of Matthew Whitaker as acting...",oil rises as opec members voice support for supply cut,"by lawrence hurley washington reuters  the us supreme court on monday stayed out of the fight over whether president donald trumps appointment of matthew whitaker as acting","{'neg': 0.164, 'neu': 0.625, 'pos': 0.211, 'compound': 0.1531}","{'neg': 0.083, 'neu': 0.801, 'pos': 0.115, 'compound': 0.25}",True,True
2019-01-10,Top 5 Things to Watch in Markets in the Week Ahead,"By Jonathan Allen
(Reuters) - Republicans in and around Forth Worth, Texas, will vote on Thursday on whether to oust a vice chairman of the county party from his post because he...",top 5 things to watch in markets in the week ahead,"by jonathan allen reuters  republicans in and around forth worth texas will vote on thursday on whether to oust a vice chairman of the county party from his post because he","{'neg': 0.0, 'neu': 0.833, 'pos': 0.167, 'compound': 0.2023}","{'neg': 0.0, 'neu': 0.859, 'pos': 0.141, 'compound': 0.5574}",True,True
2019-01-03,Top 5 Things to Watch in Markets in the Week Ahead,"By David Shepardson
WASHINGTON (Reuters) - The U.S. Senate confirmed Geoffrey Starks to join the Federal Communications Commission and approved a new term for Commissioner Brendan...",top 5 things to watch in markets in the week ahead,"by david shepardson washington reuters  the us senate confirmed geoffrey starks to join the federal communications commission and approved a new term for commissioner brendan","{'neg': 0.0, 'neu': 0.833, 'pos': 0.167, 'compound': 0.2023}","{'neg': 0.0, 'neu': 0.815, 'pos': 0.185, 'compound': 0.6124}",True,True
2018-12-14,Top 5 Things to Watch in Markets in the Week Ahead,"By Steve Holland
WASHINGTON (Reuters) - President Donald Trump's search for a new White House chief of staff is centering around former New Jersey Governor Chris Christie, senior...",top 5 things to watch in markets in the week ahead,"by steve holland washington reuters  president donald trumps search for a new white house chief of staff is centering around former new jersey governor chris christie senior","{'neg': 0.0, 'neu': 0.833, 'pos': 0.167, 'compound': 0.2023}","{'neg': 0.0, 'neu': 1.0, 'pos': 0.0, 'compound': 0.0}",True,False
2018-12-11,Top 5 Things to Watch in Markets in the Week Ahead,"By Michelle Price
(Reuters) - The White House plans to nominate Heath Tarbert, a senior Treasury official, as chairman of the U.S. Commodity Futures Trading Commission next year,...",top 5 things to watch in markets in the week ahead,"by michelle price reuters  the white house plans to nominate heath tarbert a senior treasury official as chairman of the us commodity futures trading commission next year","{'neg': 0.0, 'neu': 0.833, 'pos': 0.167, 'compound': 0.2023}","{'neg': 0.0, 'neu': 0.933, 'pos': 0.067, 'compound': 0.2023}",True,True
2018-12-10,Top 5 Things to Watch in Markets in the Week Ahead,"By Roberta Rampton and Steve Holland
WASHINGTON (Reuters) - Nick Ayers, Donald Trump's top choice to be his next chief of staff, is no longer in the running and the U.S. president...",top 5 things to watch in markets in the week ahead,"by roberta rampton and steve holland washington reuters  nick ayers donald trumps top choice to be his next chief of staff is no longer in the running and the us president","{'neg': 0.0, 'neu': 0.833, 'pos': 0.167, 'compound': 0.2023}","{'neg': 0.067, 'neu': 0.879, 'pos': 0.055, 'compound': -0.1027}",True,False
2018-12-05,Top 5 Things to Watch in Markets in the Week Ahead,"By Joseph Ax and Brendan O'Brien
MILWAUKEE (Reuters) - Protesters chanting ""Shame!"" disrupted a tree-lighting ceremony and a legislative session at the Wisconsin state capitol on...",top 5 things to watch in markets in the week ahead,"by joseph ax and brendan obrien milwaukee reuters  protesters chanting shame disrupted a treelighting ceremony and a legislative session at the wisconsin state capitol on","{'neg': 0.0, 'neu': 0.833, 'pos': 0.167, 'compound': 0.2023}","{'neg': 0.192, 'neu': 0.808, 'pos': 0.0, 'compound': -0.6124}",True,False
2018-12-05,Dow Futures Move Higher As Investors Brace for Earnings,"By Susan Cornwell
WASHINGTON (Reuters) - The likely incoming Democratic chairman of the congressional panel overseeing the U.S. census said on Tuesday he aims to pressure the...",dow futures move higher as investors brace for earnings,"by susan cornwell washington reuters  the likely incoming democratic chairman of the congressional panel overseeing the us census said on tuesday he aims to pressure the","{'neg': 0.0, 'neu': 1.0, 'pos': 0.0, 'compound': 0.0}","{'neg': 0.081, 'neu': 0.919, 'pos': 0.0, 'compound': -0.296}",False,False
2018-11-30,Top 5 Things to Watch in Markets in the Week Ahead,"By Pete Schroeder
WASHINGTON (Reuters) - A North Carolina Republican will serve as the party's top member on the House of Representatives committee overseeing banks and financial...",top 5 things to watch in markets in the week ahead,"by pete schroeder washington reuters  a north carolina republican will serve as the partys top member on the house of representatives committee overseeing banks and financial","{'neg': 0.0, 'neu': 0.833, 'pos': 0.167, 'compound': 0.2023}","{'neg': 0.0, 'neu': 0.93, 'pos': 0.07, 'compound': 0.2023}",True,True
2018-11-30,Dow Futures Move Higher As Investors Brace for Earnings,"By Patricia Zengerle
WASHINGTON (Reuters) - The U.S. Congress will have a difficult time undermining the Trump administration's close ties with Saudi Arabia, despite a Senate vote...",dow futures move higher as investors brace for earnings,"by patricia zengerle washington reuters  the us congress will have a difficult time undermining the trump administrations close ties with saudi arabia despite a senate vote","{'neg': 0.0, 'neu': 1.0, 'pos': 0.0, 'compound': 0.0}","{'neg': 0.185, 'neu': 0.815, 'pos': 0.0, 'compound': -0.6124}",False,False
2018-11-30,Oil Rises as OPEC+ Members Voice Support For Supply Cut,"By Sharon Bernstein
SACRAMENTO, Calif. (Reuters) - The chairman of the California state Democratic Party said on Thursday he would resign amid allegations that he engaged in...",oil rises as opec members voice support for supply cut,"by sharon bernstein sacramento calif reuters  the chairman of the california state democratic party said on thursday he would resign amid allegations that he engaged in","{'neg': 0.164, 'neu': 0.625, 'pos': 0.211, 'compound': 0.1531}","{'neg': 0.078, 'neu': 0.747, 'pos': 0.175, 'compound': 0.4588}",True,True
2018-11-29,Top 5 Things to Watch in Markets in the Week Ahead,"By Nick Brown and Richard Cowan
NEW YORK/WASHINGTON (Reuters) - Democrats hope to use urgent government funding talks under way in the U.S. Congress to reach a deal with...",top 5 things to watch in markets in the week ahead,"by nick brown and richard cowan new yorkwashington reuters  democrats hope to use urgent government funding talks under way in the us congress to reach a deal with","{'neg': 0.0, 'neu': 0.833, 'pos': 0.167, 'compound': 0.2023}","{'neg': 0.0, 'neu': 0.805, 'pos': 0.195, 'compound': 0.5859}",True,True
2018-11-28,Top 5 Things to Watch in Markets in the Week Ahead,"By Letitia Stein
(Reuters) - Advocates for Democrat Stacey Abrams filed a federal lawsuit on Tuesday alleging far-reaching U.S. voting rights violations during the Georgia...",top 5 things to watch in markets in the week ahead,"by letitia stein reuters  advocates for democrat stacey abrams filed a federal lawsuit on tuesday alleging farreaching us voting rights violations during the georgia","{'neg': 0.0, 'neu': 0.833, 'pos': 0.167, 'compound': 0.2023}","{'neg': 0.202, 'neu': 0.798, 'pos': 0.0, 'compound': -0.6486}",True,False
2018-11-28,Dow Futures Move Higher As Investors Brace for Earnings,"By Nick Brown
NEW YORK (Reuters) - Lawyers for the U.S. government on Tuesday wrapped up their defense of Commerce Secretary Wilbur Ross’ decision to add a citizenship...",dow futures move higher as investors brace for earnings,"by nick brown new york reuters  lawyers for the us government on tuesday wrapped up their defense of commerce secretary wilbur ross decision to add a citizenship","{'neg': 0.0, 'neu': 1.0, 'pos': 0.0, 'compound': 0.0}","{'neg': 0.0, 'neu': 0.943, 'pos': 0.057, 'compound': 0.128}",False,True
2018-11-27,Top 5 Things to Watch in Markets in the Week Ahead,"By Jonathan Stempel
NEW YORK (Reuters) - New York State's highest court said on Tuesday that the U.S. Constitution guarantees jury trials to noncitizens charged with crimes that...",top 5 things to watch in markets in the week ahead,"by jonathan stempel new york reuters  new york states highest court said on tuesday that the us constitution guarantees jury trials to noncitizens charged with crimes that","{'neg': 0.0, 'neu': 0.833, 'pos': 0.167, 'compound': 0.2023}","{'neg': 0.065, 'neu': 0.935, 'pos': 0.0, 'compound': -0.2023}",True,False
2018-11-26,Top 5 Things to Watch in Markets in the Week Ahead,"By Andrew Chung
(Reuters) - U.S. Chief Justice John Roberts defended the independence of the federal judiciary on Wednesday a day after President Donald Trump called a judge who...",top 5 things to watch in markets in the week ahead,"by andrew chung reuters  us chief justice john roberts defended the independence of the federal judiciary on wednesday a day after president donald trump called a judge who","{'neg': 0.0, 'neu': 0.833, 'pos': 0.167, 'compound': 0.2023}","{'neg': 0.0, 'neu': 0.88, 'pos': 0.12, 'compound': 0.5267}",True,True
2018-11-21,Top 5 Things to Watch in Markets in the Week Ahead,"By James Oliphant
WASHINGTON (Reuters) - Democrats made dramatic gains in this month's U.S. congressional elections despite getting little love from white, rural, working-class...",top 5 things to watch in markets in the week ahead,"by james oliphant washington reuters  democrats made dramatic gains in this months us congressional elections despite getting little love from white rural workingclass","{'neg': 0.0, 'neu': 0.833, 'pos': 0.167, 'compound': 0.2023}","{'neg': 0.119, 'neu': 0.791, 'pos': 0.09, 'compound': -0.1904}",True,False
2018-11-21,Dow Futures Move Higher As Investors Brace for Earnings,"By Jonathan Stempel
(Reuters) - A federal judge in Detroit on Tuesday declared unconstitutional a U.S. law banning female genital mutilation, and also dismissed several charges...",dow futures move higher as investors brace for earnings,"by jonathan stempel reuters  a federal judge in detroit on tuesday declared unconstitutional a us law banning female genital mutilation and also dismissed several charges","{'neg': 0.0, 'neu': 1.0, 'pos': 0.0, 'compound': 0.0}","{'neg': 0.087, 'neu': 0.913, 'pos': 0.0, 'compound': -0.2732}",False,False
2018-11-20,Top 5 Things to Watch in Markets in the Week Ahead,"By Jarrett Renshaw
NEW YORK (Reuters) - The U.S. Environmental Protection Agency will propose new targets for the final three years of the nation's renewable fuel program in...",top 5 things to watch in markets in the week ahead,"by jarrett renshaw new york reuters  the us environmental protection agency will propose new targets for the final three years of the nations renewable fuel program in","{'neg': 0.0, 'neu': 0.833, 'pos': 0.167, 'compound': 0.2023}","{'neg': 0.0, 'neu': 1.0, 'pos': 0.0, 'compound': 0.0}",True,False
2018-11-20,Dow Futures Move Higher As Investors Brace for Earnings,"By Idrees Ali and Lizbeth Diaz
WASHINGTON/TIJUANA, Mexico (Reuters) - President Donald Trump is likely to give U.S. troops authority to protect immigration agents stationed along...",dow futures move higher as investors brace for earnings,"by idrees ali and lizbeth diaz washingtontijuana mexico reuters  president donald trump is likely to give us troops authority to protect immigration agents stationed along","{'neg': 0.0, 'neu': 1.0, 'pos': 0.0, 'compound': 0.0}","{'neg': 0.0, 'neu': 0.855, 'pos': 0.145, 'compound': 0.4404}",False,True
2018-11-20,Oil Rises as OPEC+ Members Voice Support For Supply Cut,"By Dan Levine
SAN FRANCISCO - A U.S. judge on Monday temporarily blocked an order by President Donald Trump that barred asylum for immigrants who enter the country illegally from...",oil rises as opec members voice support for supply cut,"by dan levine san francisco  a us judge on monday temporarily blocked an order by president donald trump that barred asylum for immigrants who enter the country illegally from","{'neg': 0.164, 'neu': 0.625, 'pos': 0.211, 'compound': 0.1531}","{'neg': 0.072, 'neu': 0.928, 'pos': 0.0, 'compound': -0.2732}",True,False
2018-11-15,Top 5 Things to Watch in Markets in the Week Ahead,"By Patricia Zengerle
WASHINGTON (Reuters) - Republican and Democratic U.S. senators introduced legislation on Thursday seeking to strike back at Saudi Arabia over the death of a...",top 5 things to watch in markets in the week ahead,"by patricia zengerle washington reuters  republican and democratic us senators introduced legislation on thursday seeking to strike back at saudi arabia over the death of a","{'neg': 0.0, 'neu': 0.833, 'pos': 0.167, 'compound': 0.2023}","{'neg': 0.19, 'neu': 0.81, 'pos': 0.0, 'compound': -0.6597}",True,False
