Date,Title,Text,Processed Title,Processed Text,Sentiment Title,Sentiment Text,Positive Title,Positive Text
2019-11-19,Dow Futures Move Higher As Investors Brace for Earnings,"By Amanda Becker
WASHINGTON (Reuters) - U.S. Senator Elizabeth Warren said on Tuesday if elected to the White House she would use ""every tool"" at her disposal to combat white...",dow futures move higher as investors brace for earnings,"by amanda becker washington reuters  us senator elizabeth warren said on tuesday if elected to the white house she would use every tool at her disposal to combat white","{'neg': 0.0, 'neu': 1.0, 'pos': 0.0, 'compound': 0.0}","{'neg': 0.079, 'neu': 0.921, 'pos': 0.0, 'compound': -0.34}",False,False
2019-11-19,Oil Rises as OPEC+ Members Voice Support For Supply Cut,"By Patricia Zengerle
WASHINGTON (Reuters) - Federal agencies responded too slowly as Beijing recruited U.S.-based researchers to transfer intellectual property from American...",oil rises as opec members voice support for supply cut,"by patricia zengerle washington reuters  federal agencies responded too slowly as beijing recruited usbased researchers to transfer intellectual property from american","{'neg': 0.164, 'neu': 0.625, 'pos': 0.211, 'compound': 0.1531}","{'neg': 0.0, 'neu': 0.858, 'pos': 0.142, 'compound': 0.5106}",True,True
2019-11-18,Top 5 Things to Watch in Markets in the Week Ahead,"By Brendan O'Brien
(Reuters) - Louisiana Governor John Bel Edwards, a conservative Democrat, won a second term in office on Saturday, defeating a Republican opponent who had...",top 5 things to watch in markets in the week ahead,"by brendan obrien reuters  louisiana governor john bel edwards a conservative democrat won a second term in office on saturday defeating a republican opponent who had","{'neg': 0.0, 'neu': 0.833, 'pos': 0.167, 'compound': 0.2023}","{'neg': 0.095, 'neu': 0.769, 'pos': 0.136, 'compound': 0.2732}",True,True
2019-11-17,Dow Futures Move Higher As Investors Brace for Earnings,"By Jan Wolfe and Nandita Bose
WASHINGTON (Reuters) - The phone call between U.S. President Donald Trump and his Ukrainian counterpart at the center of Congress' impeachment...",dow futures move higher as investors brace for earnings,"by jan wolfe and nandita bose washington reuters  the phone call between us president donald trump and his ukrainian counterpart at the center of congress impeachment","{'neg': 0.0, 'neu': 1.0, 'pos': 0.0, 'compound': 0.0}","{'neg': 0.0, 'neu': 1.0, 'pos': 0.0, 'compound': 0.0}",False,False
2019-11-17,Oil Rises as OPEC+ Members Voice Support For Supply Cut,"By Andrea Shalal
WASHINGTON (Reuters) - South Bend Mayor Pete Buttigieg holds a clear lead among Democratic presidential candidates in Iowa, the state that will hold the first...",oil rises as opec members voice support for supply cut,"by andrea shalal washington reuters  south bend mayor pete buttigieg holds a clear lead among democratic presidential candidates in iowa the state that will hold the first","{'neg': 0.164, 'neu': 0.625, 'pos': 0.211, 'compound': 0.1531}","{'neg': 0.0, 'neu': 0.906, 'pos': 0.094, 'compound': 0.3818}",True,True
2019-11-15,Top 5 Things to Watch in Markets in the Week Ahead,"By Ginger Gibson and Michael Martina
WASHINGTON (Reuters) - Michael Bloomberg, who is weighing a bid for the Democratic nomination for president, will not attend an economic...",top 5 things to watch in markets in the week ahead,"by ginger gibson and michael martina washington reuters  michael bloomberg who is weighing a bid for the democratic nomination for president will not attend an economic","{'neg': 0.0, 'neu': 0.833, 'pos': 0.167, 'compound': 0.2023}","{'neg': 0.0, 'neu': 1.0, 'pos': 0.0, 'compound': 0.0}",True,False
2019-11-15,Dow Futures Move Higher As Investors Brace for Earnings,"By Sarah N. Lynch and Mark Hosenball
WASHINGTON (Reuters) - President Donald Trump's longtime adviser Roger Stone was convicted on all charges on Friday by a federal court...",dow futures move higher as investors brace for earnings,"by sarah n lynch and mark hosenball washington reuters  president donald trumps longtime adviser roger stone was convicted on all charges on friday by a federal court","{'neg': 0.0, 'neu': 1.0, 'pos': 0.0, 'compound': 0.0}","{'neg': 0.08, 'neu': 0.92, 'pos': 0.0, 'compound': -0.2732}",False,False
2019-11-15,Oil Rises as OPEC+ Members Voice Support For Supply Cut,"By Ginger Gibson
WASHINGTON (Reuters) - Michael Bloomberg, the billionaire media mogul who continues to weigh a run for the Democratic nomination for president, will launch a $100...",oil rises as opec members voice support for supply cut,"by ginger gibson washington reuters  michael bloomberg the billionaire media mogul who continues to weigh a run for the democratic nomination for president will launch a 100","{'neg': 0.164, 'neu': 0.625, 'pos': 0.211, 'compound': 0.1531}","{'neg': 0.0, 'neu': 1.0, 'pos': 0.0, 'compound': 0.0}",True,False
2019-11-14,Top 5 Things to Watch in Markets in the Week Ahead,"By Sarah N. Lynch and Mark Hosenball
WASHINGTON (Reuters) - The federal jury in the criminal trial of U.S. President Donald Trump's adviser Roger Stone began deliberations on...",top 5 things to watch in markets in the week ahead,"by sarah n lynch and mark hosenball washington reuters  the federal jury in the criminal trial of us president donald trumps adviser roger stone began deliberations on","{'neg': 0.0, 'neu': 0.833, 'pos': 0.167, 'compound': 0.2023}","{'neg': 0.12, 'neu': 0.88, 'pos': 0.0, 'compound': -0.5267}",True,False
2019-11-14,Dow Futures Move Higher As Investors Brace for Earnings,"By Daniel Trotta
NEW YORK (Reuters) - John Dean entered the witness protection program. Valerie Plame feared for her children.
Both are veterans of U.S. political scandals that...",dow futures move higher as investors brace for earnings,"by daniel trotta new york reuters  john dean entered the witness protection program valerie plame feared for her children both are veterans of us political scandals that","{'neg': 0.0, 'neu': 1.0, 'pos': 0.0, 'compound': 0.0}","{'neg': 0.204, 'neu': 0.796, 'pos': 0.0, 'compound': -0.7506}",False,False
2019-11-14,Oil Rises as OPEC+ Members Voice Support For Supply Cut,"By Trevor Hunnicutt
(Reuters) - Democrat Joe Biden would invest $1.3 trillion over a decade on electric car charging stations, high-speed railroads, clean-energy research and other...",oil rises as opec members voice support for supply cut,"by trevor hunnicutt reuters  democrat joe biden would invest 13 trillion over a decade on electric car charging stations highspeed railroads cleanenergy research and other","{'neg': 0.164, 'neu': 0.625, 'pos': 0.211, 'compound': 0.1531}","{'neg': 0.0, 'neu': 1.0, 'pos': 0.0, 'compound': 0.0}",True,False
2019-11-12,Top 5 Things to Watch in Markets in the Week Ahead,"By Lawrence Hurley and Andrew Chung
WASHINGTON (Reuters) - The U.S. Supreme Court is set on Tuesday to hear arguments over the legality of President Donald Trump's effort to...",top 5 things to watch in markets in the week ahead,"by lawrence hurley and andrew chung washington reuters  the us supreme court is set on tuesday to hear arguments over the legality of president donald trumps effort to","{'neg': 0.0, 'neu': 0.833, 'pos': 0.167, 'compound': 0.2023}","{'neg': 0.084, 'neu': 0.805, 'pos': 0.111, 'compound': 0.2263}",True,True
2019-11-11,Dow Futures Move Higher As Investors Brace for Earnings,"By John Whitesides and Ginger Gibson
WASHINGTON (Reuters) - Former New York City Mayor Michael Bloomberg has the money and name recognition to shake up the Democratic presidential...",dow futures move higher as investors brace for earnings,"by john whitesides and ginger gibson washington reuters  former new york city mayor michael bloomberg has the money and name recognition to shake up the democratic presidential","{'neg': 0.0, 'neu': 1.0, 'pos': 0.0, 'compound': 0.0}","{'neg': 0.061, 'neu': 0.939, 'pos': 0.0, 'compound': -0.1779}",False,False
2019-11-11,Oil Rises as OPEC+ Members Voice Support For Supply Cut,"By Jonathan Stempel
NEW YORK (Reuters) - U.S. President Donald Trump plans to ask the U.S. Supreme Court to overturn a ruling requiring his accounting firm to turn over eight years...",oil rises as opec members voice support for supply cut,"by jonathan stempel new york reuters  us president donald trump plans to ask the us supreme court to overturn a ruling requiring his accounting firm to turn over eight years","{'neg': 0.164, 'neu': 0.625, 'pos': 0.211, 'compound': 0.1531}","{'neg': 0.0, 'neu': 0.886, 'pos': 0.114, 'compound': 0.5574}",True,True
2019-11-08,Top 5 Things to Watch in Markets in the Week Ahead,"By Patricia Zengerle and Jonathan Landay
WASHINGTON (Reuters) - An official on the White House's National Security Council said he heard the U.S. ambassador to the European...",top 5 things to watch in markets in the week ahead,"by patricia zengerle and jonathan landay washington reuters  an official on the white houses national security council said he heard the us ambassador to the european","{'neg': 0.0, 'neu': 0.833, 'pos': 0.167, 'compound': 0.2023}","{'neg': 0.0, 'neu': 0.912, 'pos': 0.088, 'compound': 0.34}",True,True
2019-11-08,Dow Futures Move Higher As Investors Brace for Earnings,"By Karen Freifeld
NEW YORK (Reuters) - A supporter of U.S. President Donald Trump paid the president's personal lawyer Rudy Giuliani $500,000 on behalf of a company co-founded...",dow futures move higher as investors brace for earnings,"by karen freifeld new york reuters  a supporter of us president donald trump paid the presidents personal lawyer rudy giuliani 500000 on behalf of a company cofounded","{'neg': 0.0, 'neu': 1.0, 'pos': 0.0, 'compound': 0.0}","{'neg': 0.0, 'neu': 0.92, 'pos': 0.08, 'compound': 0.2732}",False,True
2019-11-08,Oil Rises as OPEC+ Members Voice Support For Supply Cut,"By Simon Lewis
WASHINGTON (Reuters) - U.S. Democratic presidential contender Bernie Sanders said on Thursday he would put a moratorium on deportations from the United States and...",oil rises as opec members voice support for supply cut,"by simon lewis washington reuters  us democratic presidential contender bernie sanders said on thursday he would put a moratorium on deportations from the united states and","{'neg': 0.164, 'neu': 0.625, 'pos': 0.211, 'compound': 0.1531}","{'neg': 0.0, 'neu': 0.842, 'pos': 0.158, 'compound': 0.5106}",True,True
2019-11-06,Top 5 Things to Watch in Markets in the Week Ahead,"By Brad Brooks
(Reuters) - Virginia Governor Ralph Northam's push for new gun control laws after the May massacre of 12 people in Virginia Beach flopped when the...",top 5 things to watch in markets in the week ahead,"by brad brooks reuters  virginia governor ralph northams push for new gun control laws after the may massacre of 12 people in virginia beach flopped when the","{'neg': 0.0, 'neu': 0.833, 'pos': 0.167, 'compound': 0.2023}","{'neg': 0.085, 'neu': 0.915, 'pos': 0.0, 'compound': -0.34}",True,False
2019-11-06,Dow Futures Move Higher As Investors Brace for Earnings,"By Gregory Scruggs
LOS ANGELES (Reuters) - Seattle's city council race was a toss-up between a pro-business and a progressive council on Tuesday night, despite record election...",dow futures move higher as investors brace for earnings,"by gregory scruggs los angeles reuters  seattles city council race was a tossup between a probusiness and a progressive council on tuesday night despite record election","{'neg': 0.0, 'neu': 1.0, 'pos': 0.0, 'compound': 0.0}","{'neg': 0.0, 'neu': 1.0, 'pos': 0.0, 'compound': 0.0}",False,False
2019-11-06,Oil Rises as OPEC+ Members Voice Support For Supply Cut,"By Trevor Hunnicutt
(Reuters) - U.S. presidential contender Joe Biden launched a new attack on one of his fiercest rivals in the Democratic party on Tuesday, accusing U.S. Senator...",oil rises as opec members voice support for supply cut,"by trevor hunnicutt reuters  us presidential contender joe biden launched a new attack on one of his fiercest rivals in the democratic party on tuesday accusing us senator","{'neg': 0.164, 'neu': 0.625, 'pos': 0.211, 'compound': 0.1531}","{'neg': 0.148, 'neu': 0.677, 'pos': 0.175, 'compound': -0.0258}",True,False
2019-11-05,Top 5 Things to Watch in Markets in the Week Ahead,"By Brendan Pierson
NEW YORK (Reuters) - President Donald Trump's longtime accounting firm must hand over eight years of his tax returns to New York prosecutors, a U.S. appeals...",top 5 things to watch in markets in the week ahead,"by brendan pierson new york reuters  president donald trumps longtime accounting firm must hand over eight years of his tax returns to new york prosecutors a us appeals","{'neg': 0.0, 'neu': 0.833, 'pos': 0.167, 'compound': 0.2023}","{'neg': 0.0, 'neu': 0.89, 'pos': 0.11, 'compound': 0.4939}",True,True
2019-11-05,Dow Futures Move Higher As Investors Brace for Earnings,"By Jarrett Renshaw
NEW YORK (Reuters) - Democratic presidential contender Pete Buttigieg is poised to tap into his deep financial resources to boost operations in several...",dow futures move higher as investors brace for earnings,"by jarrett renshaw new york reuters  democratic presidential contender pete buttigieg is poised to tap into his deep financial resources to boost operations in several","{'neg': 0.0, 'neu': 1.0, 'pos': 0.0, 'compound': 0.0}","{'neg': 0.0, 'neu': 0.78, 'pos': 0.22, 'compound': 0.6369}",False,True
2019-11-05,Oil Rises as OPEC+ Members Voice Support For Supply Cut,"By Tim Reid
(Reuters) - President Donald Trump's campaign team has been developing a plan to portray White House hopeful Elizabeth Warren as dishonest and untrustworthy -...",oil rises as opec members voice support for supply cut,"by tim reid reuters  president donald trumps campaign team has been developing a plan to portray white house hopeful elizabeth warren as dishonest and untrustworthy ","{'neg': 0.164, 'neu': 0.625, 'pos': 0.211, 'compound': 0.1531}","{'neg': 0.128, 'neu': 0.759, 'pos': 0.114, 'compound': -0.1027}",True,False
2019-11-02,Top 5 Things to Watch in Markets in the Week Ahead,"By Mark Hosenball and Timothy Gardner
WASHINGTON (Reuters) - U.S. Energy Secretary Rick Perry, a member of President Donald Trump's Cabinet who has played a pivotal role in...",top 5 things to watch in markets in the week ahead,"by mark hosenball and timothy gardner washington reuters  us energy secretary rick perry a member of president donald trumps cabinet who has played a pivotal role in","{'neg': 0.0, 'neu': 0.833, 'pos': 0.167, 'compound': 0.2023}","{'neg': 0.0, 'neu': 0.836, 'pos': 0.164, 'compound': 0.5423}",True,True
2019-11-02,Dow Futures Move Higher As Investors Brace for Earnings,"By Ted Hesson
WASHINGTON (Reuters) - Chad Wolf, a little-known policy staffer at the U.S. Department of Homeland Security (DHS), will be the agency's new acting secretary,...",dow futures move higher as investors brace for earnings,"by ted hesson washington reuters  chad wolf a littleknown policy staffer at the us department of homeland security dhs will be the agencys new acting secretary","{'neg': 0.0, 'neu': 1.0, 'pos': 0.0, 'compound': 0.0}","{'neg': 0.0, 'neu': 0.909, 'pos': 0.091, 'compound': 0.34}",False,True
2019-11-02,Oil Rises as OPEC+ Members Voice Support For Supply Cut,"By Tim Reid and Amanda Becker
WASHINGTON (Reuters) - Democrat Beto O'Rourke dropped out of the crowded 2020 U.S. presidential race on Friday, saying it had become clear his...",oil rises as opec members voice support for supply cut,"by tim reid and amanda becker washington reuters  democrat beto orourke dropped out of the crowded 2020 us presidential race on friday saying it had become clear his","{'neg': 0.164, 'neu': 0.625, 'pos': 0.211, 'compound': 0.1531}","{'neg': 0.0, 'neu': 0.912, 'pos': 0.088, 'compound': 0.3818}",True,True
2019-11-01,Top 5 Things to Watch in Markets in the Week Ahead,"By Simon Lewis
WASHINGTON (Reuters) - U.S. President Donald Trump’s withdrawal of forces from northern Syria in October united the Democratic candidates hoping to take on the...",top 5 things to watch in markets in the week ahead,"by simon lewis washington reuters  us president donald trumps withdrawal of forces from northern syria in october united the democratic candidates hoping to take on the","{'neg': 0.0, 'neu': 0.833, 'pos': 0.167, 'compound': 0.2023}","{'neg': 0.0, 'neu': 0.774, 'pos': 0.226, 'compound': 0.6908}",True,True
2019-10-31,Dow Futures Move Higher As Investors Brace for Earnings,"By Amanda Becker and James Oliphant
WASHINGTON (Reuters) - Democratic U.S. senators vying for the party's 2020 presidential nomination face the increasing likelihood of being...",dow futures move higher as investors brace for earnings,"by amanda becker and james oliphant washington reuters  democratic us senators vying for the partys 2020 presidential nomination face the increasing likelihood of being","{'neg': 0.0, 'neu': 1.0, 'pos': 0.0, 'compound': 0.0}","{'neg': 0.0, 'neu': 1.0, 'pos': 0.0, 'compound': 0.0}",False,False
2019-10-31,Oil Rises as OPEC+ Members Voice Support For Supply Cut,"By John Whitesides
FREDERICKSBURG, Va. (Reuters) - The off-year elections for the Virginia state legislature are often a quiet, little-noticed interlude before the frenzy of the...",oil rises as opec members voice support for supply cut,"by john whitesides fredericksburg va reuters  the offyear elections for the virginia state legislature are often a quiet littlenoticed interlude before the frenzy of the","{'neg': 0.164, 'neu': 0.625, 'pos': 0.211, 'compound': 0.1531}","{'neg': 0.091, 'neu': 0.909, 'pos': 0.0, 'compound': -0.3182}",True,False
2019-10-29,Top 5 Things to Watch in Markets in the Week Ahead,"By Jonathan Landay
WASHINGTON (Reuters) - A senior Democratic senator on Tuesday asked a U.S. government watchdog to assess Secretary of State Mike Pompeo's compliance with a...",top 5 things to watch in markets in the week ahead,"by jonathan landay washington reuters  a senior democratic senator on tuesday asked a us government watchdog to assess secretary of state mike pompeos compliance with a","{'neg': 0.0, 'neu': 0.833, 'pos': 0.167, 'compound': 0.2023}","{'neg': 0.0, 'neu': 1.0, 'pos': 0.0, 'compound': 0.0}",True,False
2019-10-29,Dow Futures Move Higher As Investors Brace for Earnings,"By Joseph Ax
NEW YORK (Reuters) - A longtime associate of former Vice President Joe Biden has launched a super PAC to support Biden's presidential candidacy after the campaign...",dow futures move higher as investors brace for earnings,"by joseph ax new york reuters  a longtime associate of former vice president joe biden has launched a super pac to support bidens presidential candidacy after the campaign","{'neg': 0.0, 'neu': 1.0, 'pos': 0.0, 'compound': 0.0}","{'neg': 0.0, 'neu': 0.74, 'pos': 0.26, 'compound': 0.7964}",False,True
2019-10-29,Oil Rises as OPEC+ Members Voice Support For Supply Cut,"By Sarah N. Lynch
WASHINGTON (Reuters) - U.S. prosecutors on Tuesday accused President Donald Trump's former national security adviser Michael Flynn of making ""an...",oil rises as opec members voice support for supply cut,"by sarah n lynch washington reuters  us prosecutors on tuesday accused president donald trumps former national security adviser michael flynn of making an","{'neg': 0.164, 'neu': 0.625, 'pos': 0.211, 'compound': 0.1531}","{'neg': 0.089, 'neu': 0.813, 'pos': 0.098, 'compound': 0.0516}",True,True
2019-10-28,Top 5 Things to Watch in Markets in the Week Ahead,"By Pete Schroeder
WASHINGTON (Reuters) - U.S. Representative Katie Hill, who is under investigation by the House ethics committee over an alleged relationship with a congressional...",top 5 things to watch in markets in the week ahead,"by pete schroeder washington reuters  us representative katie hill who is under investigation by the house ethics committee over an alleged relationship with a congressional","{'neg': 0.0, 'neu': 0.833, 'pos': 0.167, 'compound': 0.2023}","{'neg': 0.0, 'neu': 1.0, 'pos': 0.0, 'compound': 0.0}",True,False
2019-10-28,Dow Futures Move Higher As Investors Brace for Earnings,"By Steve Holland
WASHINGTON (Reuters) - For President Donald Trump, the death of Islamic State leader Abu Bakr al-Baghdadi is a signature achievement that may help quell growing...",dow futures move higher as investors brace for earnings,"by steve holland washington reuters  for president donald trump the death of islamic state leader abu bakr albaghdadi is a signature achievement that may help quell growing","{'neg': 0.0, 'neu': 1.0, 'pos': 0.0, 'compound': 0.0}","{'neg': 0.125, 'neu': 0.735, 'pos': 0.141, 'compound': -0.128}",False,False
2019-10-27,Oil Rises as OPEC+ Members Voice Support For Supply Cut,"By Ginger Gibson
WASHINGTON (Reuters) - U.S. Senator Amy Klobuchar wants to make community college and programs designed to teach technical trades free, but stopped short of...",oil rises as opec members voice support for supply cut,"by ginger gibson washington reuters  us senator amy klobuchar wants to make community college and programs designed to teach technical trades free but stopped short of","{'neg': 0.164, 'neu': 0.625, 'pos': 0.211, 'compound': 0.1531}","{'neg': 0.082, 'neu': 0.842, 'pos': 0.075, 'compound': -0.0516}",True,False
2019-10-25,Top 5 Things to Watch in Markets in the Week Ahead,"By Chris Kahn
NEW YORK (Reuters) - When Terry Brien, 64, reads about American troops pulling out of northern Syria, the Republican data manager from Colorado seethes at “one of the...",top 5 things to watch in markets in the week ahead,"by chris kahn new york reuters  when terry brien 64 reads about american troops pulling out of northern syria the republican data manager from colorado seethes at one of the","{'neg': 0.0, 'neu': 0.833, 'pos': 0.167, 'compound': 0.2023}","{'neg': 0.0, 'neu': 1.0, 'pos': 0.0, 'compound': 0.0}",True,False
2019-10-25,Dow Futures Move Higher As Investors Brace for Earnings,"By Rich McKay
(Reuters) - U.S. presidential hopeful Tulsi Gabbard's campaign announced that the Hawaiian Democrat will not seek congressional re-election, so as to focus on...",dow futures move higher as investors brace for earnings,"by rich mckay reuters  us presidential hopeful tulsi gabbards campaign announced that the hawaiian democrat will not seek congressional reelection so as to focus on","{'neg': 0.0, 'neu': 1.0, 'pos': 0.0, 'compound': 0.0}","{'neg': 0.0, 'neu': 0.769, 'pos': 0.231, 'compound': 0.7845}",False,True
2019-10-25,Oil Rises as OPEC+ Members Voice Support For Supply Cut,"By Trevor Hunnicutt and Sharon Bernstein
(Reuters) - Former Vice President Joe Biden on Thursday appeared to soften his stance against taking campaign contributions from super...",oil rises as opec members voice support for supply cut,"by trevor hunnicutt and sharon bernstein reuters  former vice president joe biden on thursday appeared to soften his stance against taking campaign contributions from super","{'neg': 0.164, 'neu': 0.625, 'pos': 0.211, 'compound': 0.1531}","{'neg': 0.0, 'neu': 0.86, 'pos': 0.14, 'compound': 0.5994}",True,True
2019-10-23,Top 5 Things to Watch in Markets in the Week Ahead,"By Trevor Hunnicutt
SCRANTON, Pa. (Reuters) - Democratic U.S. presidential contender Joe Biden plans to tout his economic policy credentials and double down on his attacks on...",top 5 things to watch in markets in the week ahead,"by trevor hunnicutt scranton pa reuters  democratic us presidential contender joe biden plans to tout his economic policy credentials and double down on his attacks on","{'neg': 0.0, 'neu': 0.833, 'pos': 0.167, 'compound': 0.2023}","{'neg': 0.152, 'neu': 0.796, 'pos': 0.052, 'compound': -0.4404}",True,False
2019-10-23,Dow Futures Move Higher As Investors Brace for Earnings,"By Sarah N. Lynch
WASHINGTON (Reuters) - U.S. President Donald Trump's former adviser Roger Stone lost a last-ditch effort on Tuesday to lift a court-imposed gag order barring...",dow futures move higher as investors brace for earnings,"by sarah n lynch washington reuters  us president donald trumps former adviser roger stone lost a lastditch effort on tuesday to lift a courtimposed gag order barring","{'neg': 0.0, 'neu': 1.0, 'pos': 0.0, 'compound': 0.0}","{'neg': 0.176, 'neu': 0.824, 'pos': 0.0, 'compound': -0.5719}",False,False
2019-10-22,Top 5 Things to Watch in Markets in the Week Ahead,"By Steve Holland and Patricia Zengerle
WASHINGTON (Reuters) - Donald Trump on Monday exhorted fellow Republicans to get tougher and fight for his presidency, saying the...",top 5 things to watch in markets in the week ahead,"by steve holland and patricia zengerle washington reuters  donald trump on monday exhorted fellow republicans to get tougher and fight for his presidency saying the","{'neg': 0.0, 'neu': 0.833, 'pos': 0.167, 'compound': 0.2023}","{'neg': 0.095, 'neu': 0.842, 'pos': 0.062, 'compound': -0.2263}",True,False
2019-10-21,Dow Futures Move Higher As Investors Brace for Earnings,"By Amanda Becker
WASHINGTON (Reuters) - White House hopeful Elizabeth Warren said on Monday that if elected she would roughly quadruple federal funding for public schools and...",dow futures move higher as investors brace for earnings,"by amanda becker washington reuters  white house hopeful elizabeth warren said on monday that if elected she would roughly quadruple federal funding for public schools and","{'neg': 0.0, 'neu': 1.0, 'pos': 0.0, 'compound': 0.0}","{'neg': 0.0, 'neu': 0.883, 'pos': 0.117, 'compound': 0.5106}",False,True
